OS_widget_id,OS_name,OS_author,OS_description,PS_filename,OS_download_url,AI_category,AI_secondary_category,AI_prompt,PS_iscoffee,PS_complexcoffee,PS_widgetfoldername,CT_set,CT_comment
canada_radar.widget,Canada Radar Map Widget,James Badger,Display auto-updating weather radar on a map widget.,canada_radar.widget.zip,https://raw.githubusercontent.com/openfirmware/canada_radar.widget/master/canada_radar.widget.zip,,,,Y,True,canada_radar.widget,,
checkProxyUrl,check-proxy,jerry,Display status of system proxy,checkProxyUrl.widget.zip,https://raw.githubusercontent.com/jerryma0912/checkProxyUrl/master/checkProxyUrl.widget.zip,,,,Y,True,checkProxyUrl.widget,,
imap-email-count.widget,IMAP Unread Emails Count,sammosna,A widget that gets unread email messages through IMAP,imap-email-count.widget.zip,https://raw.githubusercontent.com/sammosna/imap-email-count.widget/master/imap-email-count.widget.zip,,,,Y,False,imap-email-count.widget,,
uebersicht-calvin-hobbes-widget,calvin-hobbes.widget,markbradshaw,Responsive custom widget for Übersicht to show the most recent or a random Calvin and Hobbes comic strip on your desktop,calvin-hobbes.widget.zip,https://raw.githubusercontent.com/mark-bradshaw/uebersicht-calvin-hobbes-widget/master/calvin-hobbes.widget.zip,,,,Y,False,calvin-hobbes.widget,,
stockTracker,stock-tracker,Stefan Sathianathen,Displays current price for a list of stocks,stock-tracker.widget.zip,https://raw.githubusercontent.com/stefanrsathianathen/stockTracker/master/stock-tracker.widget.zip,,,,Y,False,stock-tracker.widget,,
supervisortaskwidget,SupervisorTask,kimffy24,Show running supervisor task,TaskTable.widget.zip,https://raw.githubusercontent.com/kimffy24/supervisortaskwidget/master/TaskTable.widget.zip,,,,Y,True,TaskTable.widget,,
simple-date-time-widget,Simple DateTime,Alex Hawking,A simple widget which displays the date and time,simple-datetime.widget.zip,https://raw.githubusercontent.com/Handmade-Studios/simple-date-time-widget/master/simple-datetime.widget.zip,,,,Download Failed,False,simple-datetime.widget,,
ubersicht-gitlabissues,GitlabIssues,Chase Putans,Display open gitlab issues,gitlabissues.widget.zip,https://raw.githubusercontent.com/cputans/ubersicht-gitlabissues/master/gitlabissues.widget.zip,,,,N,False,gitlabissues.widget,,
brainyquote,brainquote,William Song,Get quotes from brainyquote.com,brainyquote.zip,https://raw.githubusercontent.com/Freakwill/brainyquote/master/brainyquote.zip,,,,Y,False,brainyquote,,
uebersicht-currenttrack-widget,Current Track (Apple Music or Spotify),Krystof Rainisch,"Displays the current track from Apple Music, Spotify",currenttrack.widget.zip,https://raw.githubusercontent.com/stofi/uebersicht-currenttrack-widget/master/currenttrack.widget.zip,,,,N,False,currenttrack.widget,,
uebersicht-snowflakes,Magic Snowflakes,theLMGN + hcodes,"Snowflakes, on your desktop!",snowflake.widget.zip,https://raw.githubusercontent.com/theLMGN/uebersicht-snowflakes/master/snowflake.widget.zip,,,,N,False,snowflake.widget,,
mybar,MyBar,Gino Valente,A customizeable menubar for your OSX desktop!,mybar.widget.zip,https://raw.githubusercontent.com/MrGVSV/mybar/master/mybar.widget.zip,,,,N,False,mybar.widget,,
rescuetime-bar,Rescuetime bar,Simon Diaz,Visualize your daily Rescuetime data,rescuetime-bar.widget.zip,https://raw.githubusercontent.com/sdiazsaez/rescuetime-bar/master/rescuetime-bar.widget.zip,,,,Y,True,rescuetime-bar.widget,,
uebersicht-weather-widget,Nice Weather Widget,Li Xueli,Nice and powerful weather widget.,weather.widget.zip,https://raw.githubusercontent.com/mixj93/uebersicht-weather-widget/master/weather.widget.zip,,,,Download Failed,False,weather.widget,,
job-monitor-widget,PBS Job Monitor,Matthew Mark Strasiotto,Monitor your PBS job status's at a glance,PBSJobMonitor.widget.zip,https://raw.githubusercontent.com/mstr3336/job-monitor-widget/master/PBSJobMonitor.widget.zip,,,,N,False,PBSJobMonitor.widget,,
uebersicht-hacker-news,Hacker News Top Stories,Thomas Upton,Display recent top stories from Hacker News,uebersicht-hacker-news.widget.zip,https://raw.githubusercontent.com/tupton/uebersicht-hacker-news/master/uebersicht-hacker-news.widget.zip,,,,N,False,uebersicht-hacker-news.widget,,
uebersicht-newsticker-widget,News Ticker,Lukas Lamm,A news ticker for Übersicht using newsapi.org,newsticker.widget.zip,https://raw.githubusercontent.com/freakimkaefig/uebersicht-newsticker-widget/master/newsticker.widget.zip,,,,N,False,newsticker.widget,,
uebersicht-calendar-jsx,simple-white-calendar,ryota yamamoto,a simple white calendar,simple-white-calendar.widget.zip,https://raw.githubusercontent.com/ymmooot/uebersicht-calendar-jsx/master/simple-white-calendar.widget.zip,,,,N,False,simple-white-calendar.widget,,
ubersicht-ios-clock-upnext-weather,iOS Widget Suite,Viktor Klíma (vecnehladny),Simple iOS styled widget section for Übersicht,ubersicht-ios-clock-upnext-weather.widget.zip,https://raw.githubusercontent.com/vecnehladny/ubersicht-ios-clock-upnext-weather/master/ubersicht-ios-clock-upnext-weather.widget.zip,,,,Y,True,ubersicht-ios-clock-upnext-weather.widget,,
simple-neo-clock,simple-neo-widget,c0dine,A neomorphic clock,simple-neo-clock.widget.zip,https://raw.githubusercontent.com/c0dine/simple-neo-clock/master/simple-neo-clock.widget.zip,,,,Y,True,simple-neo-clock.widget,,
uebersicht-widget-raspberryData,Raspberry Data,Johannes Hubig,"Raspberry Data is a widget that presents you information about your Raspberry Pi like CPU temperature, voltages and much more.",raspberryData.widget.zip,https://raw.githubusercontent.com/jhubig/uebersicht-widget-raspberryData/master/raspberryData.widget.zip,,,,Y,True,raspberryData.widget,,
ubersicht-termina-widget,bash terminal widget,Viktor Klíma (vecnehladny),Simple bash terminal styled widget for Übersicht,terminal.widget.zip,https://raw.githubusercontent.com/vecnehladny/ubersicht-termina-widget/master/terminal.widget.zip,,,,Y,True,terminal.widget,,
taskwarrior-ready,Top 5 Actionable Taskwarrior Tasks,Marek Kowalczyk,Display first five tasks meeting the 'ready' filter. You might need to adjust the filter settings in Taskwarrior to get the desired view. Widget based on Upcoming-iCal-Events by Connor Beardsmore.,taskwarrior-ready.widget.zip,https://raw.githubusercontent.com/marekkowalczyk/taskwarrior-ready/master/taskwarrior-ready.widget.zip,,,,Y,True,taskwarrior-ready.widget,,
uebersicht-widget-fritzBoxPro,FritzBoxPro,Johannes Hubig,"Widget for Übersicht to display data of your Fritz!Box like Firmware version, provider name, uptime and much more.",fritzBoxPro.widget.zip,https://raw.githubusercontent.com/jhubig/uebersicht-widget-fritzBoxPro/master/fritzBoxPro.widget.zip,,,,Y,True,fritzBoxPro.widget,,
uebersicht-widget-TwitterProfile,Twitter Profile,Johannes Hubig,Twitter Profile is a widget that displays the twitter profile picture and the number of followers. Not more not less :),twitterProfile.widget.zip,https://raw.githubusercontent.com/jhubig/uebersicht-widget-TwitterProfile/master/twitterProfile.widget.zip,,,,Y,False,twitterProfile.widget,,
UeberPlayer,UeberPlayer,Daniel Hernandez,A widget to elegantly display the currently playing song from Apple Music or Spotify,UeberPlayer.widget.zip,https://raw.githubusercontent.com/aCluelessDanny/UeberPlayer/master/UeberPlayer.widget.zip,,,,N,False,UeberPlayer.widget,,
uebersicht-widget-diskMeter,diskMeter,Reven Sanchez,Minimal disk usage meter,diskMeter.widget.zip,https://raw.githubusercontent.com/reven/uebersicht-widget-diskMeter/master/diskMeter.widget.zip,,,,Y,True,diskMeter.widget,,
drunk-o-clock-widget,Drunk-o-clock,Jonathan Tumulak,Port of drunk-o-clock pebble watchface,drunk-o-clock.widget.zip,https://raw.githubusercontent.com/jonathantumulak/drunk-o-clock-widget/master/drunk-o-clock.widget.zip,,,,N,False,drunk-o-clock.widget,,
black-bottom-bar-ubersicht-widgets,Black bottom bar,Hanne Maes,"A minimalistic black bottom bar showing the time, date and battery level",black-bottom-bar.widget.zip,https://raw.githubusercontent.com/HanneMaes/black-bottom-bar-ubersicht-widgets/master/black-bottom-bar.widget.zip,,,,Y,False,black-bottom-bar.widget,,
uebersicht-FanBar-widget,Fans and CPU,syto203,Fans Speed and CPU Temperature,fan-bar.widget.zip,https://raw.githubusercontent.com/syto203/uebersicht-FanBar-widget/master/fan-bar.widget.zip,,,,Y,False,fan-bar.widget,,
uebersicht-airpod-status,Airpod Connection Status,Acidham,Shows if there is an AirPod connected or not,AirPods.widget.zip,https://raw.githubusercontent.com/Acidham/uebersicht-airpod-status/master/AirPods.widget.zip,,,,Y,False,AirPods.widget,,
ExchangeMeetings.widget,upcoming Exchange meetings,Tony Rice,displays upcoming meetings from your Exchange calendar. Join WebEx or Zoom meetings with a click.,ExchangeMeetings.widget.zip,https://raw.githubusercontent.com/rtphokie/ExchangeMeetings.widget/master/ExchangeMeetings.widget.zip,,,,Y,True,ExchangeMeetings.widget,,
lacompagniedesombres-ubersicht,La Compagnie des Ombres for Ubersicht,RemiixInc,"A rewrite of the popular Rainmeter Skin, La Compagnie des Ombres.",lacompagniedesombres.widget.zip,https://raw.githubusercontent.com/RemiixInc/lacompagniedesombres-ubersicht/master/lacompagniedesombres.widget.zip,,,,Y,True,lacompagniedesombres.widget,,
digitaldesktopclock,digitaldesktopclok,Alon Idelson,a digital desktop clock that is visiable as long as the dock is open,digitaldesktopclock.widget.zip,https://raw.githubusercontent.com/alonidel/digitaldesktopclock/master/digitaldesktopclock.widget.zip,,,,Y,False,digitaldesktopclock.widget,,
profile.widget,Profile,sammosna,A nice way to see your profile picture right in the middle of your desktop.,profile.widget.zip,https://raw.githubusercontent.com/sammosna/profile.widget/master/profile.widget.zip,,,,N,False,profile.widget,,
Ubersicht-World-Clock-Widget,World Clock Widget,Rafael Contreras,Übersicht widget to visualize the time at different timezones.,ubersitch-world-clock.widget.zip,https://raw.githubusercontent.com/rafcontreras/Ubersicht-World-Clock-Widget/master/ubersitch-world-clock.widget.zip,,,,N,False,ubersitch-world-clock.widget,,
stockxticker,stockx.widget,God,,stockx.widget.zip,https://raw.githubusercontent.com/alihayrula12/stockxticker/master/stockx.widget.zip,,,,Y,False,stockx.widget,,
uebersicht-purpleair,Purple Air AQI Widget,Benjamin Pucci,Air Quality (AQI) from the Purple Air API,purpleaqi.widget.zip,https://raw.githubusercontent.com/th3jamin/uebersicht-purpleair/master/purpleaqi.widget.zip,,,,N,False,purpleaqi.widget,,
TodoListWidget,ToDo List & Weather,Hazard4U,Widget for weather and apple reminders,TodoListWidget.widget.zip,https://raw.githubusercontent.com/Hazard4U/TodoListWidget/master/TodoListWidget.widget.zip,,,,N,False,TodoListWidget.widget,,
SmoothAnalogClock.widget,Smooth Analog Clock,ruurd,A hardware accelerated analog clock with smooth running pointers,SmoothAnalogClock.widget.zip,https://raw.githubusercontent.com/ruurd/SmoothAnalogClock.widget/master/SmoothAnalogClock.widget.zip,,,,Y,True,SmoothAnalogClock.widget,,
uebersicht-yinyang-widget,yinyang-lavalamp,ChaosElephant,floating 3d css-only yinyang animation,yinyang-lavalamp.widget.zip,https://raw.githubusercontent.com/ChaosElephant/uebersicht-yinyang-widget/master/yinyang-lavalamp.widget.zip,,,,Y,False,yinyang-lavalamp.widget,,
ooberweather,oober-forecast,Galen McQuillen,a widget to display a transparent metogram from NOAA,ooberweather.widget.zip,https://raw.githubusercontent.com/McQdev/ooberweather/master/ooberweather.widget.zip,,,,Download Failed,False,ooberweather.widget,,
openhab2-widget,OpenHAB2 widget for Übersicht,Limatationz,This is a small widget für 'Übersicht' where you can have an overview of your openHAB2 items on your desktop.,openHAB2.widget.zip,https://raw.githubusercontent.com/Limatationz/openhab2-widget/master/openHAB2.widget.zip,,,,Y,True,openHAB2.widget,,
Docker-Box-Widget,Docker Box,Neuton Foo,"Yes, another Docker widget.",docker-box.widget.zip,https://raw.githubusercontent.com/neutonfoo/Docker-Box-Widget/master/docker-box.widget.zip,,,,N,False,docker-box.widget,,
MiniBar-Widget,MiniBar,Neuton Foo,Yet another bar widget.,MiniBar-Widget.widget.zip,https://raw.githubusercontent.com/neutonfoo/MiniBar-Widget/master/MiniBar-Widget.widget.zip,,,,N,False,MiniBar-Widget.widget,,
Really-Simple-Spotify-Widget,Really Simple Spotify Widget,Neuton Foo,A REALLY simple and minimal Now Playing Spotify widget.,Really-Simple-Spotify-Widget.widget.zip,https://raw.githubusercontent.com/neutonfoo/Really-Simple-Spotify-Widget/master/Really-Simple-Spotify-Widget.widget.zip,,,,N,False,Really-Simple-Spotify-Widget.widget,,
uebersicht-now-playing,Now playing,Rickard Natt och Dag,Now playing in Spotify,now-playing.widget.zip,https://raw.githubusercontent.com/believer/uebersicht-now-playing/master/now-playing.widget.zip,,,,Download Failed,False,now-playing.widget,,
uebersicht-fetch,Fetch for Übersicht,Aleksi Lassila,"Shows stats such as system, network and weather information on your desktop, much like neofetch.",fetch.widget.zip,https://raw.githubusercontent.com/aleksilassila/uebersicht-fetch/master/fetch.widget.zip,,,,N,False,fetch.widget,,
ubersicht-instaframe,InstaFrame,Tommy Farley,Instagram photos in Ubersicht via SnapWidget,ubersicht-instframe.zip,https://raw.githubusercontent.com/twfarley/ubersicht-instaframe/master/ubersicht-instframe.zip,,,,Y,False,ubersicht-instframe,,
ubersicht-quote-of-the-day,quote-of-the-day.widget,@stonecoder,A widget that displays a random quote from They Said So Quotes API,quote-of-the-day.widget.zip,https://raw.githubusercontent.com/stoneC0der/ubersicht-quote-of-the-day/master/quote-of-the-day.widget.zip,,,,N,False,quote-of-the-day.widget,,
ubersicht-calendar-widget,calendar,Konstantin Nazarov,Shows your today calendar,calendar.widget.zip,https://raw.githubusercontent.com/knazarov/ubersicht-calendar-widget/master/calendar.widget.zip,,,,Download Failed,False,calendar.widget,,
march-covid,March Covid,Scott Immerman,"Displays the number of days since March 1, 2020 (or any day you choose). Since things are in limbo since that date.",MarchCovid.widget.zip,https://raw.githubusercontent.com/TechJedi51/march-covid/master/MarchCovid.widget.zip,,,,N,False,MarchCovid.widget,,
uebersicht-widet-icinga,Icinga Monitoring,G. Carafa,Icinga tactical overview,icinga.widget.zip,https://raw.githubusercontent.com/mms-gianni/uebersicht-widet-icinga/master/icinga.widget.zip,,,,Y,False,icinga.widget,,
ultralist-ubersicht-widget,Ultralist Widget (CommandLine Todo List),Maru,Übersicht Widget for Ultralist,ultralist.widget.zip,https://raw.githubusercontent.com/leejongyoung/ultralist-ubersicht-widget/master/ultralist.widget.zip,,,,Download Failed,False,ultralist.widget,,
ironman-reactor2-ubersicht-widget,Ironman Reactor Widget,Maru,Übersicht Widget for Ironman Reactor,ironman-reactor.widget.zip,https://raw.githubusercontent.com/leejongyoung/ironman-reactor2-ubersicht-widget/master/ironman-reactor.widget.zip,,,,Download Failed,False,ironman-reactor.widget,,
RedditMembers.widget,Reddit members,sammosna,"Keep an eye on the number of members of a subreddit. Useful for monitoring, for example, the growth of new altcoins.",RedditMembers.widget.zip,https://raw.githubusercontent.com/sammosna/RedditMembers.widget/master/RedditMembers.widget.zip,,,,N,False,RedditMembers.widget,,
Persona_5_Calendar,Persona 5 Calendar,Juan Jose Paz,Persona 5 Style Calendar for Übersicht.,Persona_5_Calendar.zip,https://raw.githubusercontent.com/darkjuanjo/Persona_5_Calendar/master/Persona_5_Calendar.zip,,,,N,False,Persona_5_Calendar,,
social_media_widget,adjustable social media icons,Alex Horban,add your favourite social media links to your desktop,social_media.widget.zip,https://raw.githubusercontent.com/ohorban/social_media_widget/master/social_media.widget.zip,,,,Y,False,social_media.widget,,
photo-slideshow-ubersicht-widget,Photo Slideshow,David Yee,Periodically display images from your favourite image folder,photo-frame.widget.zip,https://raw.githubusercontent.com/david201601/photo-slideshow-ubersicht-widget/master/photo-frame.widget.zip,,,,N,False,photo-frame.widget,,
trash-empty-ubersicht-widget,Trash Emptied,David Yee,Simple widget to monitor and double-click to clear trash files,trash-empty.widget.zip,https://raw.githubusercontent.com/david201601/trash-empty-ubersicht-widget/master/trash-empty.widget.zip,,,,N,False,trash-empty.widget,,
system-control,System Control,Manoj Kumar Garwa,"A simple, System control for Sleep, restart & Shutdown made for Übersicht.",system-control.widget.zip,https://raw.githubusercontent.com/mkgarwa/system-control/master/system-control.widget.zip,,,,Y,False,system-control.widget,,
Ubersicht-Position,Position,Dominique Da Silva,Control the placement of other widgets.,position.widget.zip,https://raw.githubusercontent.com/atika/Ubersicht-Position/master/position.widget.zip,,,,N,False,position.widget,,
ubersicht-clock,clock-with-greetings.widget,@stonecoder,A widget to display time and greetings with username,ubersicht-clock.widget.zip,https://raw.githubusercontent.com/stoneC0der/ubersicht-clock/master/ubersicht-clock.widget.zip,,,,N,False,ubersicht-clock.widget,,
taylor-swift-ubersicht,Taylor Swift Quote Widget,Tristan Brookes,Shows a random Taylor Swift image from Imgur and a quote within a 1989 polaroid frame,taylor-swift-quote.widget.zip,https://raw.githubusercontent.com/tristyb/taylor-swift-ubersicht/master/taylor-swift-quote.widget.zip,,,,N,False,taylor-swift-quote.widget,,
CryptoMarketCap,Crypto Market Cap,"Manyan Chan, Richard",Widget to get the latest cryptocurrency market cap.,CryptoMarketCap.widget.zip,https://raw.githubusercontent.com/manyan-chan/CryptoMarketCap/master/CryptoMarketCap.widget.zip,,,,N,False,CryptoMarketCap.widget,,
french-revolutionary-calendar,French revolutionary calendar,Vojtech Loskot,A calendar widget which displays the current day in the French revolutionary calendar.,french-revolutionary-clock.widget.zip,https://raw.githubusercontent.com/Penguibird/french-revolutionary-calendar/master/french-revolutionary-clock.widget.zip,,,,N,False,french-revolutionary-clock.widget,,
ubersicht-unread-gmail,ubersicht-unread-gmail,Devan Looches,Ubersicht Gmail Checker Written in Rust asynchronously using the Gmail Api,unreadmail.widget.zip,https://raw.githubusercontent.com/devanlooches/ubersicht-unread-gmail/master/unreadmail.widget.zip,,,,Y,False,unreadmail.widget,,
TautulliWidget,Tautulli Widget,Scott Immerman,"This is a widget that displays what is playing on your Plex server, via Tautulli..",TautulliWidget.widget.zip,https://raw.githubusercontent.com/TechJedi51/TautulliWidget/master/TautulliWidget.widget.zip,,,,N,False,TautulliWidget.widget,,
LuminousTime,Luminous Time,Virej Dasani,"An animated gradient background, time widget",luminous-time.widget.zip,https://raw.githubusercontent.com/virejdasani/LuminousTime/master/luminous-time.widget.zip,,,,Y,True,luminous-time.widget,,
Folder-Launcher.widget-improved-,Folder-Launcher.widget-improved,Aaryav Jaiswal,Easy folder acces from your desktop,Folder Launcher.zip,https://raw.githubusercontent.com/Aaryav2307/Folder-Launcher.widget-improved-/master/Folder Launcher.zip,,,,Y,False,Folder Launcher,,
StockTickerWidget,Stock Ticker Widget,Veeranna,Stocks widget using Yahoo Finance.,StockTicker.widget.zip,https://raw.githubusercontent.com/veeranagouda/StockTickerWidget/master/StockTicker.widget.zip,,,,Y,True,StockTicker.widget,,
FroxceySidebar,Froxcey Sidebar,Froxcey,Adds sidebar that allows you to download YouTube music and videos (youtube-dl is required),FroxceySidebar.widget.zip,https://raw.githubusercontent.com/froxcey/FroxceySidebar/master/FroxceySidebar.widget.zip,,,,N,False,FroxceySidebar.widget,,
searchbar,searchbar,dfdnqlgm,search web by word or URL from your desktop,searchbar.widget.zip,https://raw.githubusercontent.com/dfdnqlgm/searchbar/master/searchbar.widget.zip,,,,Y,False,searchbar.widget,,
uebersicht-particals,Partical Js,Nuhel,"Partical js, on your desktop!",particals.widget.zip,https://raw.githubusercontent.com/Nuhel/uebersicht-particals/master/particals.widget.zip,,,,N,False,particals.widget,,
uebersicht_kf_control,Simple Dashboard,"Marc Finnern, klickfabrik",Display some simple information to your desktop. Simple and Smart. With spotifytrack-information,kf_control.coffee.widget.zip,https://raw.githubusercontent.com/Klickfabrik/uebersicht_kf_control/master/kf_control.coffee.widget.zip,,,,Y,True,kf_control.coffee.widget,,
Ubersicht-Monit,Monit,Dominique Da Silva,Show status of instances monitored with monit.,monit.widget.zip,https://raw.githubusercontent.com/atika/Ubersicht-Monit/master/monit.widget.zip,,,,N,False,monit.widget,,
APOD,APOD,Skunk,NASA-APOD desktop wallpaper image and video render,APOD.widget.zip,https://raw.githubusercontent.com/KiwiSkunk/APOD/master/APOD.widget.zip,,,,N,False,APOD.widget,,
openhab3-widget,OpenHAB3,Limatationz,This is a small widget für 'Übersicht' where you can have an overview of your openHAB3 items on your desktop.,openhab3.widget.zip,https://raw.githubusercontent.com/Limatationz/openhab3-widget/master/openhab3.widget.zip,,,,Y,True,openhab3.widget,,
RandomQuranAyah-ubersicht-widget,randomQuranAyah,RamiAlzayat on GitHub,A widget that displays a random quran ayah everyday,randomQuranAyah.widget.zip,https://raw.githubusercontent.com/RamiAlzayat/RandomQuranAyah-ubersicht-widget/master/randomQuranAyah.widget.zip,,,,Y,False,randomQuranAyah.widget,,
uebersicht-live2d,waifu,hurray,A live2d waifu,waifu.widget.zip,https://raw.githubusercontent.com/Hurray0/uebersicht-live2d/master/waifu.widget.zip,,,,Y,False,waifu.widget,,
CaptainAmericaCivilWarriorShield,captain america civil warrior shield,Aryan Kanda,Civil Warrior Shield with built in Arc Reactor,captain america civil warrior shield.widget.zip,https://raw.githubusercontent.com/IroMan121333/CaptainAmericaCivilWarriorShield/master/captain america civil warrior shield.widget.zip,,,,Y,False,captain america civil warrior shield.widget,,
nextGame_currentGame-NHL,nextGame/currentGame-NHL.widget,Woody Neilson,Widget displaying the next/current game information for your favorite NHL team,NextGame_CurrentGame-NHL.widget.zip,https://raw.githubusercontent.com/nineDoor/nextGame_currentGame-NHL/master/NextGame_CurrentGame-NHL.widget.zip,,,,Y,True,NextGame_CurrentGame-NHL.widget,,
microcalendar,microcalendar,LiltoneJG,Tiny calendar widget to display iCal Events in the right/left space next to the macOS Dock,microcalendar.widget.zip,https://raw.githubusercontent.com/LiltoneJG/microcalendar/master/microcalendar.widget.zip,,,,N,False,microcalendar.widget,,
discordian-date.widget,Discordian date,hpcodecraft,"Shows the current discordian date and holy day, if there is one.",discordian-date.widget.zip,https://raw.githubusercontent.com/hpcodecraft/discordian-date.widget/master/discordian-date.widget.zip,,,,Download Failed,False,discordian-date.widget,,
moon-phase.widget,Moon phase,hpcodecraft,Shows the current moon phase.,moon-phase.widget.zip,https://raw.githubusercontent.com/hpcodecraft/moon-phase.widget/master/moon-phase.widget.zip,,,,Download Failed,False,moon-phase.widget,,
bitcoin-mempool.widget,Bitcoin Mempool,hpcodecraft,Shows information about the Bitcoin mempool,bitcoin-mempool.widget.zip,https://raw.githubusercontent.com/hpcodecraft/bitcoin-mempool.widget/master/bitcoin-mempool.widget.zip,,,,Download Failed,False,bitcoin-mempool.widget,,
bitcoin-moscow-time.widget,Bitcoin Moscow Time,hpcodecraft,Shows the Bitcoin Moscow Time in different currencies,bitcoin-moscow-time.widget.zip,https://raw.githubusercontent.com/hpcodecraft/bitcoin-moscow-time.widget/master/bitcoin-moscow-time.widget.zip,,,,Download Failed,False,bitcoin-moscow-time.widget,,
bitcoin-price.widget,Bitcoin price,hpcodecraft,Shows the Bitcoin price in different currencies,bitcoin-price.widget.zip,https://raw.githubusercontent.com/hpcodecraft/bitcoin-price.widget/master/bitcoin-price.widget.zip,,,,Download Failed,False,bitcoin-price.widget,,
uebersicht-aerial,Aerial - Apple TV Screensavers for Übersicht,Aleksi Lassila,Streams Apple TV screensavers to your desktop.,aerial.widget.zip,https://raw.githubusercontent.com/aleksilassila/uebersicht-aerial/master/aerial.widget.zip,,,,N,False,aerial.widget,,
bdt-currency-converter.widget,BDT Currency Converter ,Zakir Sajib,"This widget is using exchangeratesapi api to get currency and convert them into Bangladesh Taka (BDT). Currently it has Euro, USD and GBP currency. To use this widget you need an api key from exchangeratesapi.io which is free. This widget is tested on high sierra and big sur with iMac and Macbook Pro 2011 model. This widget is highly customizable. Style, Code.",bdt-currency-converter.widget.zip,https://raw.githubusercontent.com/zakirsajib/bdt-currency-converter.widget/master/bdt-currency-converter.widget.zip,,,,Y,True,bdt-currency-converter.widget,,
macos-version-and-uptime-widget,macOS Version and Up-Time Widget,Scott Immerman,"A widget to display macOS name, version, build and uptime on the desktop. The Build number can be hidden and the widget is themable. Four themes are included: mono, paper, dark and color.",macos-version-and-uptime.widget.zip,https://raw.githubusercontent.com/TechJedi51/macos-version-and-uptime-widget/master/macos-version-and-uptime.widget.zip,,,,Y,True,macos-version-and-uptime.widget,,
world-clock-widget,World Clock Widget,Ricky Shi,The missing world clock widget for Übersicht.,world-clock.widget.zip,https://raw.githubusercontent.com/shiyouping/world-clock-widget/master/world-clock.widget.zip,,,,N,False,world-clock.widget,,
daysWidget,remainig days,Dominik Müller,The approx. days you'll live,remainingDays.coffee.zip,https://raw.githubusercontent.com/muellerdom/daysWidget/master/remainingDays.coffee.zip,,,,Y,False,remainingDays.coffee,,
