OS_widget_id,OS_name,OS_author,OS_description,PS_filename,OS_download_url,AI_category,AI_secondary_category,AI_prompt,PS_iscoffee,PS_complexcoffee,PS_widgetfoldername,CT_set,CT_comment
AnalogClock,Analog Clock,Chris Johnson,A fully customizable analog clock. Two example clocks are included. Please see the ReadMe document for more details.,AnalogClock.widget.zip,https://raw.githubusercontent.com/felixhageloh/uebersicht-widgets/master/AnalogClock/AnalogClock.widget.zip,,,,Y,True,AnalogClock.widget,,
BackgroundGrid,Background Grid,Chris Johnson,A fully customizable full-screen grid.,BackgroundGrid.widget.zip,https://raw.githubusercontent.com/felixhageloh/uebersicht-widgets/master/BackgroundGrid/BackgroundGrid.widget.zip,,,,Y,True,BackgroundGrid.widget,,
Black-Bar-Widget,Black Bar,"Jack Bricker, Evan Goode",Adds a 5 pixel tall black bar at the bottom of the screen to fix the issue of window height to account for a hidden dock.,black-bar.widget.zip,https://raw.githubusercontent.com/jrb12364/Black-Bar-Widget/master/./black-bar.widget.zip,,,,Y,False,black-bar.widget,,
CPU-Usage-bar-Widget,CPU Usage Bar,Daniel Barca,Display total CPU usage with a progress bar. Design based on Network Throughput by Adam Courtemanche.,cpu-usage-bar.widget.zip,https://raw.githubusercontent.com/DaniBarca/CPU-Usage-bar-Widget/master/./cpu-usage-bar.widget.zip,,,,Y,False,cpu-usage-bar.widget,,
Circular-CPU,CPU Circle Widget,Alexandru Popa,A widget that displays your CPU usage in a fancy circle,cpu.widget.zip,https://raw.githubusercontent.com/zanderp/Mac-CPU-Widget/master/./cpu.widget.zip,,,,N,False,cpu.widget,,
Circular-RAM,Circle RAM Widget,Alexandru Popa,A widget that displays your RAM usage in a fancy circle,circular-ram.widget.zip,https://raw.githubusercontent.com/zanderp/circular-ram-widget/master/./circular-ram.widget.zip,,,,N,False,circular-ram.widget,,
CoverArt,CoverArt,Andreas @slowbiex Schaefer,copies the current album cover from iTunes to display on desktop,CoverArt.widget.zip,https://raw.githubusercontent.com/slowburn/CoverArt/master/./CoverArt.widget.zip,,,,Y,False,CoverArt.widget,,
CurrLocation,CurrLocation,Jim Kimmel,"Displays the city and state for the current location based on the current public IP address, using freegeoip.net.",CurrLocation.widget.zip,https://raw.githubusercontent.com/jckimmel/CurrLocation/master/./CurrLocation.widget.zip,,,,Y,False,CurrLocation.widget,,
Daily-Random-Kanji,Daily Random Kanji,Connor Beardsmore,Shows a new random Kanji everyday,Daily-Random-Kanji.widget.zip,https://raw.githubusercontent.com/cbeardsmore/Daily-Random-Kanji/master/./Daily-Random-Kanji.widget.zip,,,,Y,True,Daily-Random-Kanji.widget,,
DailyBibleVerse,daily bible verse,justice amoh,a daily bible verse from crossway esv,dailybibleverse.widget.zip,https://raw.githubusercontent.com/justiceamoh/DailyBibleVerse/master/./dailybibleverse.widget.zip,,,,Y,False,dailybibleverse.widget,,
DiskUsage-Bar,DiskUsage bar,Shawn Ding,A Disk Usage bar widget for Übersicht.,diskusage-bar.widget.zip,https://raw.githubusercontent.com/dinever/DiskUsage-Bar-Widget/master/./diskusage-bar.widget.zip,,,,Y,True,diskusage-bar.widget,,
Docker-Uber-Stats,Docker Machines,Andrew Pepin,See running docker machines at a glance.,dockermachinestats.widget.zip,https://raw.githubusercontent.com/Paradiddley/Docker-Uber-Stats/master/./dockermachinestats.widget.zip,,,,Y,True,dockermachinestats.widget,,
Evangelion,Evangelion style dashboard,Jetic Gu,Inspired by the comic EVANGELION.,Evangelion_style_dashboard.widget.zip,https://raw.githubusercontent.com/jeticg/Evangelion-Uebersicht-Widget/master/./Evangelion_style_dashboard.widget.zip,,,,Y,True,Evangelion_style_dashboard.widget,,
FancyDateTime,Fancy DateTime,Robin 'codeFareith' von den Bergen,Übersicht widget for displaying current time and date,fancy-datetime.widget.zip,https://raw.githubusercontent.com/codeFareith/uebersicht-FancyDateTime/master/./fancy-datetime.widget.zip,,,,Y,True,fancy-datetime.widget,,
GitFinder,GitFinder,Dominique Da Silva,Scan visible Finder Windows and display Git Projects Statistics,gitfinder.widget.zip,https://raw.githubusercontent.com/atika/Ubersicht-GitFinder/master/./gitfinder.widget.zip,,,,Y,True,gitfinder.widget,,
Hangu-Word-Clock,Hangul Square Clock,Kwanghyun Ko,Übersicht widget for displaying current time in Korean,square_word_clock_hangul.widget.zip,https://raw.githubusercontent.com/openmaya/Uebersicht-Hangul-Word-Clock/master/./square_word_clock_hangul.widget.zip,,,,Y,True,square_word_clock_hangul.widget,,
JapaneseCalendar-widget,JapaneseCalendar,gr3yR0n1n,Display a simple calendar for the current month in Japanese.,JapaneseCalendar.widget.zip,https://raw.githubusercontent.com/Gr3yR0n1n/JapaneseCalendar-widget/master/./JapaneseCalendar.widget.zip,,,,Download Failed,False,JapaneseCalendar.widget,,
Mandarin-Chinese-Word-Of-The-Day-widget,Mandarin Chinese Word Of The Day,Ben Moore,"This widget displays a chinese word of the day along with pinyin for pronunciation, a definition and an example sentance",mandarin-chinese-word-of-the-day.zip,https://raw.githubusercontent.com/himynameisbeni/Mandarin-Chinese-Word-Of-The-Day-widget/master/./mandarin-chinese-word-of-the-day.zip,,,,Download Failed,False,mandarin-chinese-word-of-the-day,,
NetworkInfo,NetworkInfo,Chris Johnson,Displays current Ethernet and Wi-Fi status (connected / not connected / IP Address / Mac Address.,NetworkInfo.widget.zip,https://raw.githubusercontent.com/felixhageloh/uebersicht-widgets/master/NetworkInfo/NetworkInfo.widget.zip,,,,Y,True,NetworkInfo.widget,,
Nightshades,NightShades,Porco-Rosso,"This widget alows to quickly apply a dark overlay or 'Shades' to the wallpaper. With a cmd+click on the shades icon you can turn the $wag on and off, and adjust the level as needed. Warning does not block UV rays.",NightShades.widget.zip,https://raw.githubusercontent.com/Porco-Rosso/Ubersicht-Nightshades/master/./NightShades.widget.zip,,,,Y,False,NightShades.widget,,
Plexpy-Ubersicht-Widget,Plexpy Widget,Johannes Heck,A simple widget to display current streams from your Plex Server.,Plexpy.widget.zip,https://raw.githubusercontent.com/yoyostile/Plexpy-Ubersicht-Widget/master/./Plexpy.widget.zip,,,,Y,True,Plexpy.widget,,
RSSs_Ubersicht_Widget,RSSs widget,Erik Dasque,Display items from multiple RSS feeds,RSSs.widget.zip,https://raw.githubusercontent.com/edasque/RSSs_Ubersicht_Widget/master/./RSSs.widget.zip,,,,Y,True,RSSs.widget,,
Rdio-Widget,rdio-current-track,Lari Kovanen,Displays current track played by Rdio,rdio-current-track.widget.zip,https://raw.githubusercontent.com/larkov/Rdio-Widget/master/./rdio-current-track.widget.zip,,,,Y,False,rdio-current-track.widget,,
RemindersWidget,Reminders,"David L. Day, Jordi Kitto",Display pending Reminders.,reminders.widget.zip,https://raw.githubusercontent.com/davidlday/RemindersWidget/master/./reminders.widget.zip,,,,Y,True,reminders.widget,,
SPS,Storyline Productivity Schedule,Mike Wilson,Displays your daily SPS for the Day,sps.widget.zip,https://raw.githubusercontent.com/wilsongis/uebersicht-SPS_Widget/master/./sps.widget.zip,,,,Y,False,sps.widget,,
ScoreTicker,ScoreTicker,Jim Kimmel,Displays current sport scores in a ticker-style format,ScoreTicker.widget.zip,https://raw.githubusercontent.com/jckimmel/ScoreTicker/master/./ScoreTicker.widget.zip,,,,Y,False,ScoreTicker.widget,,
Set-networking,Set-Networking,David Brookes,a widget to easily set your ip address to Static or DHCP,Set-networking.widget.zip,https://raw.githubusercontent.com/brookesdjb/Set-networking.widget/master/./Set-networking.widget.zip,,,,Y,False,Set-networking.widget,,
Sidebar,Sidebar,Piotr Gajos,The mother of all widgets!,Sidebar.widget.zip,https://raw.githubusercontent.com/Pe8er/Sidebar.Widget/master/./Sidebar.widget.zip,,,,Y,True,Sidebar.widget,,
Simple-Uber-Device-Status,Simple Keyboard/Mouse Stats,Andrew Pepin,Minimal bluetooth device stats.,devicebatt.widget.zip,https://raw.githubusercontent.com/Paradiddley/Simple-Uber-Device-Status/master/./devicebatt.widget.zip,,,,Y,True,devicebatt.widget,,
Simple-Uber-Disk-Usage,Simple Disk Stats,Andrew Pepin,Minimal occupied space status.,hddspace.widget.zip,https://raw.githubusercontent.com/Paradiddley/Simple-Uber-Disk-Usage/master/./hddspace.widget.zip,,,,Y,False,hddspace.widget,,
Simple-Uber-System-Status,Simple System Battery Stats,Andrew Pepin,Minimal machine battery status.,systembatt.widget.zip,https://raw.githubusercontent.com/Paradiddley/Simple-Uber-System-Status/master/./systembatt.widget.zip,,,,Y,False,systembatt.widget,,
SimpleDate,SimpleDate,Spencer Kaiser – @spencerkaiser on GitHub,A widget that displays the current date,SimpleDate.widget.zip,https://raw.githubusercontent.com/felixhageloh/uebersicht-widgets/master/SimpleDate/SimpleDate.widget.zip,,,,Y,True,SimpleDate.widget,,
SolTunes.widget,SolTunes,John Wachter,Solarized display of iTunes song info with progress bar,SolTunes.widget.zip,https://raw.githubusercontent.com/yohnnyjoe/SolTunes.widget/master/./SolTunes.widget.zip,,,,Y,False,SolTunes.widget,,
Spotify-Current-Track,SpotifyCurrentTrack,ThomasBrace,Displays current track palying in spotify,spotify-current-track.widget.zip,https://raw.githubusercontent.com/felixhageloh/uebersicht-widgets/master/Spotify-Current-Track/spotify-current-track.widget.zip,,,,Y,True,spotify-current-track.widget,,
Stock-quotes-Widget,Stock quotes widget,Erik Dasque,Displays stock quotes in a table format with color-coding of wins/loss,stock.widget.zip,https://raw.githubusercontent.com/edasque/Stock-quotes-Widget/master/./stock.widget.zip,,,,Y,True,stock.widget,,
Strava.widget,Strava Progress,Piotr Gajos,This widget grabs your weekly and yearly biking stats from Strava and displays them in a somewhat visual manner.,Strava.widget.zip,https://raw.githubusercontent.com/Pe8er/Strava.widget/master/./Strava.widget.zip,,,,Y,True,Strava.widget,,
TaskwarriorWidget,Taskwarrior Widget,Kevin Bockelandt,Displays the list of pending tasks from Taskwarrior,task.widget.zip,https://raw.githubusercontent.com/KevinBockelandt/TaskwarriorWidget/master/./task.widget.zip,,,,Y,True,task.widget,,
Time-in-Words,Time in words,Raphael Hanneken,Displays the current time in words.,timeinwords.widget.zip,https://raw.githubusercontent.com/behoernchen/Time-in-Words/master/./timeinwords.widget.zip,,,,Y,True,timeinwords.widget,,
ToDo,ToDo,illuminati945,a small widget to display ToDo’s from a .txt file,ToDo.widget.zip,https://raw.githubusercontent.com/illuminati945/ToDo/master/./ToDo.widget.zip,,,,Y,True,ToDo.widget,,
Today,Today,Chris Johnson,"A small collection of widgets that show daily information: Today's Date, Today in History (from History.com), Today's News (from Reuters) and Today's Word (from WordSmith.org).",Today.widget.zip,https://raw.githubusercontent.com/felixhageloh/uebersicht-widgets/master/Today/Today.widget.zip,,,,Y,False,Today.widget,,
Ubersicht-DiskUsage-bar,Disk Usage bar,Onishy,disk usage bar meter.,disk-usage-bar.widget.zip,https://raw.githubusercontent.com/onishy/Ubersicht-DiskUsage-bar/master/./disk-usage-bar.widget.zip,,,,Y,False,disk-usage-bar.widget,,
Ubersicht-Matrix,Matrix,Porco-Rosso,This widget allows to set a matrix-like falling code visualization to your desktop background. Warning: This might be CPU intensive!,matrix.widget.zip,https://raw.githubusercontent.com/Porco-Rosso/Ubersicht-Matrix/master/./matrix.widget.zip,,,,N,False,matrix.widget,,
Ubersicht_zendesk_jg,Zendesk Ticket Tracker,John Galbraith,Display Zendesk tickets for the location you're at by IP range.,helpdesk.widget.zip,https://raw.githubusercontent.com/jagalbraith/Ubersicht_zendesk_jg/master/./helpdesk.widget.zip,,,,Y,True,helpdesk.widget,,
UpcomingEvents,Upcoming iCal Events,Connor Beardsmore,"Shows UpcomingEvents, using icalBuddy and the Mac Calendar",Upcoming-iCal-Events.widget.zip,https://raw.githubusercontent.com/cbeardsmore/UpcomingEvents/master/./Upcoming-iCal-Events.widget.zip,,,,Y,True,Upcoming-iCal-Events.widget,,
WiFi-SSID-Widget,WiFi SSID,Joe Kelley,Displays the current connected wifi network SSID,WiFi-SSID-Widget.zip,https://raw.githubusercontent.com/mactexan/WiFi-SSID-Widget/master/./WiFi-SSID-Widget.zip,,,,Y,False,WiFi-SSID-Widget,,
WiFi-Tx-Speed,wifi-tx-speed,Joe Kelley,Collects and displays the current actual transmission speed of your WiFi connection,wifi-tx-speed.widget.zip,https://raw.githubusercontent.com/mactexan/WiFi-Tx-Speed/master/./wifi-tx-speed.widget.zip,,,,Y,True,wifi-tx-speed.widget,,
WorldClock,World Clock,Chris Johnson,A widget that shows multiple timezones in either horizontal or vertical orientation,WorldClock.widget.zip,https://raw.githubusercontent.com/felixhageloh/uebersicht-widgets/master/WorldClock/WorldClock.widget.zip,,,,Y,True,WorldClock.widget,,
WunderlistTasksWidget,Wunderlist Tasks,Makiah Bennett,Display Wunderlist open tasks,WunderlistTasksWidget.zip,https://raw.githubusercontent.com/Makiah/WunderlistTasksWidget/master/./WunderlistTasksWidget.zip,,,,Y,True,WunderlistTasksWidget,,
XiamiFM,Xiami FM,ProfFan,A widget for display now playing for Xiami FM,XiamiRadio.widget.zip,https://raw.githubusercontent.com/ProfFan/Ubersicht-XiamiFM/master/./XiamiRadio.widget.zip,,,,Y,False,XiamiRadio.widget,,
Xkcd-now,XKCD Now,Adin Baumgarten,xkcd.com/now widget,Now.widget.zip,https://raw.githubusercontent.com/AlataMors/Ubersicht-Xkcd-now/master/./Now.widget.zip,,,,Y,False,Now.widget,,
Youtube-Channel,Youtube,Dominique Da Silva,Display infos of an Youtube channel.,youtube.widget.zip,https://raw.githubusercontent.com/atika/Ubersicht-Youtube/master/./youtube.widget.zip,,,,Y,True,youtube.widget,,
Yr4u,yr4ubersicht,Lari Kovanen,48h forecast display from yr,yr4ubersicht.widget.zip,https://raw.githubusercontent.com/larkov/Yr4Ubersicht/master/./yr4ubersicht.widget.zip,,,,Y,False,yr4ubersicht.widget,,
air-quality.widget,air-quality,Fan Zhen,Show air quality index from aqicn.org,air-quality.widget.zip,https://raw.githubusercontent.com/FanZhen2002/air-quality.widget/master/./air-quality.widget.zip,,,,Y,False,air-quality.widget,,
analog-clock-widget,Analog Clock,Ashik uddin Ahmad,A beautiful themeable analog clock,analog-clock.widget.zip,https://raw.githubusercontent.com/ashikahmad/analog-clock-widget/master/./analog-clock.widget.zip,,,,Y,True,analog-clock.widget,,
animated-background,Animated Backgrounds,Josh Butner,Adds a floating multi-part background.,background.widget.zip,https://raw.githubusercontent.com/Baxter900/background-widget/master/./background.widget.zip,,,,Y,True,background.widget,,
anydo,AnyDo.widget,Mislav Cimpersak,AnyDo widget for Ubersicht,anydo.widget.zip,https://raw.githubusercontent.com/mislavcimpersak/anydo-widget/master/./anydo.widget.zip,,,,Y,True,anydo.widget,,
aoede,Aoede,Pyraxo,Monstercat-esque music widget,Aoede.widget.zip,https://raw.githubusercontent.com/pyraxo/aoede/master/./Aoede.widget.zip,,,,Y,True,Aoede.widget,,
app-launcher,app-launcher.widget,Travis Triglianos,Adds an application launcher to the desktop,app-launcher.widget.zip,https://raw.githubusercontent.com/travtrigs/app-launcher.widget/master/./app-launcher.widget.zip,,,,Download Failed,False,app-launcher.widget,,
authentic-weather,Authentic Weather,Itzael Martinez,widget of the most honest weather app,authentic.widget.zip,https://raw.githubusercontent.com/reduxd/authentic-ubersicht/master/./authentic.widget.zip,,,,Y,True,authentic.widget,,
backgroundwidget,Daily Background Wallpaper,Sam Roach,Will pull daily photos from bings photos of the day and set as your wallpaper,background.widget.zip,https://raw.githubusercontent.com/roach0123/backgroundwidget/master/./background.widget.zip,,,,Y,True,background.widget,,
bar,Bar,Cody Callahan,A menubar replacement that displays basic information and the currently playing song from Spotify/Youtube/Soundcloud,bar.widget.zip,https://raw.githubusercontent.com/callahanrts/bar/master/./bar.widget.zip,,,,N,False,bar.widget,,
bart-widget,BART Departure Times,Matisse Hack,Displays the next two times of departure for each BART train leaving a particular stop,bart.widget.zip,https://raw.githubusercontent.com/MatisseHack/bart-widget/master/./bart.widget.zip,,,,Y,True,bart.widget,,
battery-charge,BatteryCharge,Brandon Seda,Displays charge percentage and charge state,BatteryCharge.widget.zip,https://raw.githubusercontent.com/bcseda/BatteryCharge/master/./BatteryCharge.widget.zip,,,,Y,False,BatteryCharge.widget,,
battery,battery,Johan Bleuzen,Display current battery percentage and status,battery.widget.zip,https://raw.githubusercontent.com/felixhageloh/uebersicht-widgets/master/battery/battery.widget.zip,,,,Y,False,battery.widget,,
batteryDetails.widget,batteryDetails,Klaus Gruber,"Displays battery, charge percentage and charge state",batteryDetails.widget.zip,https://raw.githubusercontent.com/bausi2k/batteryDetails.widget/master/./batteryDetails.widget.zip,,,,Y,True,batteryDetails.widget,,
binari-clock,ubersicht-binary-clock,Joel Eisner,A simple binary clock widget built for the Übersicht desktop extension for Mac OSX,binary-clock.widget.zip,https://raw.githubusercontent.com/jeisner93/ubersicht-binary-clock/master/./binary-clock.widget.zip,,,,Y,False,binary-clock.widget,,
bingwall,bingwall,Alessandro Bertacco,bing wallpaper widget,bingwall.widget.zip,https://raw.githubusercontent.com/alebertacco/bingwall/master/./bingwall.widget.zip,,,,Download Failed,False,bingwall.widget,,
bluetooth-battery-bar,Bluetooth Battery bar,Glen Schrader,A Bluetooth Battery Usage bar widget for Übersicht.,bluetooth-battery-bar.widget.zip,https://raw.githubusercontent.com/gschrader/ubersicht-bluetooth-battery-bar/master/./bluetooth-battery-bar.widget.zip,,,,Y,True,bluetooth-battery-bar.widget,,
blur-widget,Blur,Dominique Da Silva,Create background blurred zones,blur.widget.zip,https://raw.githubusercontent.com/atika/Ubersicht-Blur/master/./blur.widget.zip,,,,Y,True,blur.widget,,
btc-eur,btceur,@cesckat,"Get the last bitcoin price. Now, in EUR (€)",btceur.widget.zip,https://raw.githubusercontent.com/felixhageloh/uebersicht-widgets/master/btc-eur/btceur.widget.zip,,,,Y,False,btceur.widget,,
btc-prices,Bitcoin Prices,David Parry,Shows several exchange rate prices for different currencies.,btc-prices.widget.zip,https://raw.githubusercontent.com/felixhageloh/uebersicht-widgets/master/btc-prices/btc-prices.widget.zip,,,,Y,True,btc-prices.widget,,
btc,btc,Daniel Spillere Andrade,Get current bitcoin price in USD.,btc.widget.zip,https://raw.githubusercontent.com/felixhageloh/uebersicht-widgets/master/btc/btc.widget.zip,,,,Y,False,btc.widget,,
byrthdays.widget,Byrthdays,Oliver Fürniß,Shows upcoming birthdays from your macOS Contacts,byrthdays.widget.zip,https://raw.githubusercontent.com/olfuerniss/byrthdays.widget/master/./byrthdays.widget.zip,,,,Y,True,byrthdays.widget,,
calendar,calendar,Adam Vaughan,Display a simple calendar for the current month.,calendar.zip,https://raw.githubusercontent.com/felixhageloh/uebersicht-widgets/master/calendar/calendar.zip,,,,Y,True,calendar,,
circleci-widget,CircleCI status,André Medeiros,Keep an eye on your running builds and their status.,circleci.widget.zip,https://raw.githubusercontent.com/andremedeiros/circleci-widget/master/./circleci.widget.zip,,,,Y,True,circleci.widget,,
circular-liquid-battery-widget,Circular Liquid Battery Widget,Alexandru Popa,An animated circular liquid battery widget,circular-liquid-battery.widget.zip,https://raw.githubusercontent.com/zanderp/circular-liquid-battery-widget/master/./circular-liquid-battery.widget.zip,,,,N,False,circular-liquid-battery.widget,,
cjdns,uber-cjdns,Luke Evers,A widget to test ping times with CJDNS,uber-cjdns.widget.zip,https://raw.githubusercontent.com/lukevers/uber-cjdns/master/./uber-cjdns.widget.zip,,,,Y,False,uber-cjdns.widget,,
coding-net-notifications.widget,Coding.net Notifications,Usual,Pull down Coding.net notifications and display them on desktop with Ubersicht.,coding-net-notifications.widget.zip,https://raw.githubusercontent.com/IUsual/coding-net-notifications.widget/master/./coding-net-notifications.widget.zip,,,,Y,True,coding-net-notifications.widget,,
commandment-11,11th Commandment,Chris Scharff,a cypher for your desktop ,commandment-11.widget.zip,https://raw.githubusercontent.com/cscharff/commandment-11/master/./commandment-11.widget.zip,,,,Y,True,commandment-11.widget,,
commands-feed.widget,Commands Feed,Pradeep Patro,Random commands from http://commandlinefu.com,commands-feed.widget.zip,https://raw.githubusercontent.com/smartameer/commands-feed.widget/master/./commands-feed.widget.zip,,,,Y,False,commands-feed.widget,,
conky-for-mac,conky-for-mac,Jeff Cartwright,"Conky is a common linux desktop widget. However, OS X does not support conky. Conky-for-mac provides similar functionality to conky. Using coffeeScript and Übersicht, the widget is easily modified to meet your needs",conky-for-mac-widget.zip,https://raw.githubusercontent.com/dumbo25/conky-for-mac/master/./conky-for-mac-widget.zip,,,,Y,True,conky-for-mac-widget,,
countdown,Countdown,Anurag Bakshi,Displays a list of countdowns.,countdown.widget.zip,https://raw.githubusercontent.com/anuragbakshi/Countdown-Widget/master/./countdown.widget.zip,,,,Y,True,countdown.widget,,
cpu-bar,CPU bar,David Peredo,CPU bar designed to go with Coby Chapple's Memory Bar.,cpu-bar.widget.zip,https://raw.githubusercontent.com/PerishableDave/ubersicht-cpu-bar/master/./cpu-bar.widget.zip,,,,Y,False,cpu-bar.widget,,
craigslist,craigslist,Charlie Hield,An Übersicht widget for pulling in a Craigslist seach.,craigslist.widget.zip,https://raw.githubusercontent.com/stursby/uebersicht-craigslist/master/./craigslist.widget.zip,,,,Y,True,craigslist.widget,,
cryptowidget,Cryptocurrency Desktop Widget,Sebastian Stiernborg,Basic desktop widget for Mac to help track the price of bitcoin and ethereum but can also be used for all coins supported by cryptocompare's awesome API (www.cryptocompare.com). Inspired by Adam Courtemanche's widget Simple Stocks.,cryptocurrency.widget.zip,https://raw.githubusercontent.com/avocadomaster/cryptowidget/master/./cryptocurrency.widget.zip,,,,Download Failed,False,cryptocurrency.widget,,
currency-converter,currency-converter,@kikorb,Get the exchange rate for two given currencies,currency-converter.widget.zip,https://raw.githubusercontent.com/kikorb/currency-conversor/master/./currency-converter.widget.zip,,,,Y,True,currency-converter.widget,,
cuteical.widget,cute calendar events,Cara Takemoto,Displays events from iCal with cute bullet marks,cuteical.widget.zip,https://raw.githubusercontent.com/ctakemoto/cuteical.widget/master/./cuteical.widget.zip,,,,Y,True,cuteical.widget,,
d3-clock,d3 polar clock,Christian Maurer,d3.js polar clock widget for uebersicht,d3-clock-uebersicht-widget.widget.zip,https://raw.githubusercontent.com/cmaurer/d3-clock-uebersicht-widget/master/./d3-clock-uebersicht-widget.widget.zip,,,,N,False,d3-clock-uebersicht-widget.widget,,
daily-xkcd-uebersicht-widget,xkcd,Dale Manthei – @dalemanthei on GitHub,A widget that displays the current xkcd comic,xkcd.widget.zip,https://raw.githubusercontent.com/dalemanthei/daily-xkcd-uebersicht-widget/master/./xkcd.widget.zip,,,,Y,False,xkcd.widget,,
disk-usage,Disk Usage,Adam Courtemanche,"Shows disk usage for mounted disks, with the option to exclude specific disks. Update: New option for showing disk sizes.",disk-usage.widget.zip,https://raw.githubusercontent.com/felixhageloh/uebersicht-widgets/master/disk-usage/disk-usage.widget.zip,,,,Y,True,disk-usage.widget,,
doviz-ticker,Döviz Ticker,Serkan Yılmaz,Dolar alış/satış rakamlarını masaüstünüzde gösterir.,doviz-ticker.widget.zip,https://raw.githubusercontent.com/xcolor/doviz-ticker/master/./doviz-ticker.widget.zip,,,,Y,False,doviz-ticker.widget,,
earth_view,Earth View Background,Nicholas Maggio,Grabs a random image from Google Earth View and displays as Background,earth-view.widget.zip,https://raw.githubusercontent.com/Maggick-/earth_view/master/./earth-view.widget.zip,,,,Y,False,earth-view.widget,,
fever-hotlinks,Fever RSS Hotlinks,Tom Allen,Displays interactive hotlinks from a Fever RSS installation,fever.widget.zip,https://raw.githubusercontent.com/telega/fever-widget/master/./fever.widget.zip,,,,Y,True,fever.widget,,
fever-rss,Fever RSS count,Martin Ziel,Shows the number of unread RSS articles,fever-rss.widget.zip,https://raw.githubusercontent.com/felixhageloh/uebersicht-widgets/master/fever-rss/fever-rss.widget.zip,,,,Y,True,fever-rss.widget,,
folder-launcher,folder-launcher.widget,Travis Triglianos,Adds a folder launcher to the desktop,folder-launcher.widget.zip,https://raw.githubusercontent.com/travtrigs/folder-launcher.widget/master/./folder-launcher.widget.zip,,,,Download Failed,False,folder-launcher.widget,,
forecast,Forecast,Josh Gibbs @ Louis Orleans,Uses the Forecast.io API to create a nice looking weather forecast.,forecast.widget.zip,https://raw.githubusercontent.com/uPaymeiFixit/forecast-widget/master/./forecast.widget.zip,,,,N,False,forecast.widget,,
fuzzytime,fuzzytime,Geoff Oliver,Display fuzzy time in the top left of your desktop,fuzzytime.widget.zip,https://raw.githubusercontent.com/plan8studios/fuzzytime/master/./fuzzytime.widget.zip,,,,Y,True,fuzzytime.widget,,
gcal-widget,Google Calendar Upcoming Events,Matt Kilens,The next 5 events from your Google Calendar along with time and location,UpcomingEvents.widget.zip,https://raw.githubusercontent.com/mattk410/gcal-widget/master/./UpcomingEvents.widget.zip,,,,N,False,UpcomingEvents.widget,,
german-word-of-the-day,German Word of the Day,Tassilo Selover-Stephan,Shows you the german word of the day!,german-word-of-the-day.widget.zip,https://raw.githubusercontent.com/felixhageloh/uebersicht-widgets/master/german-word-of-the-day/german-word-of-the-day.widget.zip,,,,Y,False,german-word-of-the-day.widget,,
