OS_widget_id,OS_name,OS_author,OS_description,PS_filename,OS_download_url,AI_category,AI_secondary_category,AI_prompt,PS_iscoffee,PS_complexcoffee,PS_widgetfoldername,CT_set,CT_comment
git-log,Git Log,Ricky Smith,Display recent commits from your selected git repository,Git-Log.widget.zip,https://raw.githubusercontent.com/DigitallyBorn/Ubersicht-Git-Log/master/./Git-Log.widget.zip,,,,Y,True,Git-Log.widget,,
git-stats.widget,git-stats widget,Martin Straub,show some git stats,git-stats.widget.zip,https://raw.githubusercontent.com/d4rkd3v1l/uebersicht-git-stats.widget/master/./git-stats.widget.zip,,,,Y,False,git-stats.widget,,
github-notifications,GitHub Notifications,Matt Smith,GitHub Notifications by type,github-notifications.widget.zip,https://raw.githubusercontent.com/mtscout6/uebersicht-github-notifications/master/./github-notifications.widget.zip,,,,Y,True,github-notifications.widget,,
google-cal,Next events for multiple Google Calendars,Dimitri König,Displays next events for multiple Google Calendars,uebersicht-widget-for-google-cal.widget.zip,https://raw.githubusercontent.com/dimitri-koenig/uebersicht-widget-for-google-cal/master/./uebersicht-widget-for-google-cal.widget.zip,,,,N,False,uebersicht-widget-for-google-cal.widget,,
grid-launcher,Grid Launcher,Daniel Dangond,"A simple, colorful application launcher made for Übersicht.",grid-launcher.widget.zip,https://raw.githubusercontent.com/ddgond/uebersicht-grid-launcher/master/./grid-launcher.widget.zip,,,,Y,True,grid-launcher.widget,,
horizontal-calendar-widget,Horizontal Calendar,Ashik uddin Ahmad,A sleek Dateline-like horizontal calendar,hcal.widget.zip,https://raw.githubusercontent.com/ashikahmad/horizontal-calendar-widget/master/./hcal.widget.zip,,,,N,False,hcal.widget,,
iTunes-now,Now Playing in iTunes,Patrick Braiden,"Shows the name, artist and album of the current song in iTunes",itunes-now.widget.zip,https://raw.githubusercontent.com/felixhageloh/uebersicht-widgets/master/iTunes-now/itunes-now.widget.zip,,,,Y,True,itunes-now.widget,,
iTunesLyrics.widget,iTunes Lyrics Display,Piotr Gajos,This widget shows embedded lyrics for the currently playing iTunes song.,iTunesLyrics.widget.zip,https://raw.githubusercontent.com/Pe8er/iTunesLyrics.widget/master/./iTunesLyrics.widget.zip,,,,Y,False,iTunesLyrics.widget,,
iTunesMiniPlayer.widget,iTunes Mini Player,Jose Campos,"A widget that let's you see the cover of the song you are listening to, play the next and previous song, and play/pause your music",iTunesMiniPlayer.widget.zip,https://raw.githubusercontent.com/jscampos/iTunesMiniPlayer.widget/master/./iTunesMiniPlayer.widget.zip,,,,Y,True,iTunesMiniPlayer.widget,,
ical-widget,Calendar Events,David Brooks,Displays Calendar (Built-in Mac App) events for today and tomorrow. Using icalBuddy found here: http://hasseg.org/icalBuddy/,ical.widget.zip,https://raw.githubusercontent.com/djbrooks111/ical-widget/master/./ical.widget.zip,,,,Y,True,ical.widget,,
inspirational-quote,Inspirational Quote,Alex Anderson,"Inspirational quote of the day from brainyquote.com, with direction drawn from the German Quote of the Day widget",inspirational-quote.widget.zip,https://raw.githubusercontent.com/felixhageloh/uebersicht-widgets/master/inspirational-quote/inspirational-quote.widget.zip,,,,Y,False,inspirational-quote.widget,,
iostats,I/O Stats,Eric Miller,Show current throughput statistics for the specified disk.  Style based on Top CPU and Top MEM widgets by Felix Hageloh.,iostats.widget.zip,https://raw.githubusercontent.com/felixhageloh/uebersicht-widgets/master/iostats/iostats.widget.zip,,,,Y,True,iostats.widget,,
istats.widget,iStats Widget,Roland Schaer,Widgets for the iStats Ruby gem to display SMC information about your system.,istats.widget.zip,https://raw.githubusercontent.com/roele/istats.widget/master/./istats.widget.zip,,,,N,False,istats.widget,,
jenkins,Jenkins,Bruno Pires,Get the jobs status from your jenkins CI into your desktop,widget.zip,https://raw.githubusercontent.com/piresbruno/uebersicht-jenkins/master/./widget.zip,,,,Y,True,widget,,
justthedate,justthedate,Ruurd Pels,Display just the date top right of your desktop,justthedate.widget.zip,https://raw.githubusercontent.com/ruurd/justthedate/master/./justthedate.widget.zip,,,,Y,True,justthedate.widget,,
kaspersky-threats,kaspersky-threats,Joe Kelley,Display 3D animation of global cyberthreats,kaspersky-threats.widget.zip,https://raw.githubusercontent.com/mactexan/kaspersky-threats/master/./kaspersky-threats.widget.zip,,,,Y,False,kaspersky-threats.widget,,
kindle-random-quote,Kindle Clippings,Alex Pletnev,Show a random clipping from your 'My Clippings.txt',kindle-clippings.widget.zip,https://raw.githubusercontent.com/apletnev/ubersicht-kindle-random-quote/master/./kindle-clippings.widget.zip,,,,Y,True,kindle-clippings.widget,,
lastfm,Last.FM,Patrick Pan,Beautiful widget for last scrobbled track from Last.FM,lastfm.widget.zip,https://raw.githubusercontent.com/patrickhpan/lastfm-ubersicht/master/./lastfm.widget.zip,,,,Y,True,lastfm.widget,,
led-clock,LED Clock,Imran Zahid,Digital Clock in LED format,ledclock.widget.zip,https://raw.githubusercontent.com/imranzahid01/led-clock/master/./ledclock.widget.zip,,,,N,False,ledclock.widget,,
lightroom-latest,lightroom-latest,Evan Payne,Pull latest picked & tagged images from a Lightroom Catalog.,lightroom-latest.widget.zip,https://raw.githubusercontent.com/evanfuture/lightroom-latest.widget/master/./lightroom-latest.widget.zip,,,,Y,True,lightroom-latest.widget,,
litecoin-widget,Litecoin Prices,Geoff Oliver,Shows the price for litecoin.,ltc-price.widget.zip,https://raw.githubusercontent.com/plan8studios/litecoin-widget/master/./ltc-price.widget.zip,,,,Y,False,ltc-price.widget,,
load-avg,Load Average,Eric Miller,"Display the 1, 5, and 15-minute load averages of your system. Style based on Top CPU and Top MEM widgets by Felix Hageloh.",load-avg.widget.zip,https://raw.githubusercontent.com/felixhageloh/uebersicht-widgets/master/load-avg/load-avg.widget.zip,,,,Y,True,load-avg.widget,,
lol-current-game,League of Legends Current Game,Josh Butner,Shows your current LoL game.,lol-current-game.widget.zip,https://raw.githubusercontent.com/Baxter900/lol-current-game/master/./lol-current-game.widget.zip,,,,Y,True,lol-current-game.widget,,
lol-stats,League of Legends Stats,Nigel D'Souza,An Uebersicht widget for Mac to display your League of Legends profile and most recent match details,lol-stats.widget.zip,https://raw.githubusercontent.com/Xcrucifier/lol-stats-widget/master/./lol-stats.widget.zip,,,,Y,True,lol-stats.widget,,
longviewer-widget,Longviewer Widget,Tom Allen,Linode Longview server information,longviewer-widget.widget.zip,https://raw.githubusercontent.com/telega/longviewer-widget/master/./longviewer-widget.widget.zip,,,,Y,True,longviewer-widget.widget,,
macports,Macports Outdated,Nicholas Maggio,Displays a list of Outdated Macports,macports.widget.zip,https://raw.githubusercontent.com/Maggick-/macports/master/./macports.widget.zip,,,,Y,True,macports.widget,,
mail-and-messages.widget,mail-and-messages,Travis Triglianos,"Displays number of unread mail and messages, and provides shortcut to open respective apps",mail-and-messages.widget.zip,https://raw.githubusercontent.com/travtrigs/Unread-Messages.widget/master/./mail-and-messages.widget.zip,,,,Download Failed,False,mail-and-messages.widget,,
mail-count-read.widget,mail-count-read.widget,Andy Dishong,"Displays the count of unread mail messages and from:, subject: header.",mail-count-read.widget.zip,https://raw.githubusercontent.com/roadglide03/mail-count-read.widget/master/./mail-count-read.widget.zip,,,,Y,False,mail-count-read.widget,,
mail,Unread mail count,Martin Ziel,Shows the number of unread mails in Mail.app,mail.widget.zip,https://raw.githubusercontent.com/felixhageloh/uebersicht-widgets/master/mail/mail.widget.zip,,,,Y,False,mail.widget,,
mailcount,mc,William Falk-Wallace,Take a quick glance at your gmail inbox count,mc.widget.zip,https://raw.githubusercontent.com/wfalkwallace/mailcount/master/./mc.widget.zip,,,,Y,True,mc.widget,,
markdown_cheat_sheet,Markdown Preview,jacksonfylle,Display a markdown file,CheatSheet.widget.zip,https://raw.githubusercontent.com/jacksonfylle/Ubersicht/master/./CheatSheet.widget.zip,,,,Y,True,CheatSheet.widget,,
mbta-widget,MBTA Status,Joshua Wilcox,Show the next three MBTA trains at a given station,mbta.widget.zip,https://raw.githubusercontent.com/joshuaswilcox/mbta-widget/master/./mbta.widget.zip,,,,Y,True,mbta.widget,,
memory-bar,Memory bar,Coby Chapple,A simple system memory usage meter.,memory-bar.widget.zip,https://raw.githubusercontent.com/cobyism/ubersicht-memory-bar/master/./memory-bar.widget.zip,,,,Y,False,memory-bar.widget,,
mini-system-charts.widget,Mini System Charts,Alex Rowe,"Collections of mini charts displaying current system usage: CPU, RAM, disk usage, and network traffic.",mini-system-charts.widget.zip,https://raw.githubusercontent.com/aprowe/mini-system-charts.widget/master/./mini-system-charts.widget.zip,,,,Y,True,mini-system-charts.widget,,
minimal-forecast-widget,Minimal Forecast,Calum Smith,A clean and understated display of the temperature trend over the next week,minimal-forecast.widget.zip,https://raw.githubusercontent.com/cpmsmith/minimal-forecast-widget/master/./minimal-forecast.widget.zip,,,,Y,True,minimal-forecast.widget,,
minimal-github-widgit,Minimal Github Contributions,Ean Platter,A minimal github contributions graph for your desktop.,github-minimal.widget.zip,https://raw.githubusercontent.com/eanplatter/minimal-github-widgit/master/./github-minimal.widget.zip,,,,Y,False,github-minimal.widget,,
minimal_weather,minimal weather,Grant Park,a weather widget without bullshit,minimal_weather.zip,https://raw.githubusercontent.com/sungjp/minimal_weather/master/./minimal_weather.zip,,,,Y,False,minimal_weather,,
moon-phase,Moon Phase,Joe Creighton,A widget for Übersicht.,moon-phase.widget.zip,https://raw.githubusercontent.com/joecreighton/moon-phase/master/./moon-phase.widget.zip,,,,Y,True,moon-phase.widget,,
morning,Morning,Rohan Likhite,"A clone of the popular Google Chrome extension, Momentum.",morning.widget.zip,https://raw.githubusercontent.com/imRohan/ubersicht-morning.widget/master/./morning.widget.zip,,,,Y,True,morning.widget,,
multiple-locations-weather,Multiple Locations Weather,Rubén Abad,Displays current weather and week forecast for the provided locations,multiple-locations-weather.widget.zip,https://raw.githubusercontent.com/rabad/uebersicht-multiple-locations-weather/master/./multiple-locations-weather.widget.zip,,,,Y,True,multiple-locations-weather.widget,,
muni.widget,SF Muni Arrival Times,Daniel Maurath,Live updating arrival times for San Francisco Muni,muni.widget.zip,https://raw.githubusercontent.com/dmaurath/muni.widget/master/./muni.widget.zip,,,,Y,False,muni.widget,,
netspeeds-widget,Netspeeds,Charles Schoenfeld,"Displays your in/out speeds via Ethernet and AirPort, and the local IP address of each port.",netspeeds.widget.zip,https://raw.githubusercontent.com/cschoenfeld/netspeeds-widget/master/./netspeeds.widget.zip,,,,N,False,netspeeds.widget,,
network-throughput,Network Throughput,Adam Courtemanche,Shows incoming and outgoing throughput on a user-specified network interface,network-throughput.widget.zip,https://raw.githubusercontent.com/felixhageloh/uebersicht-widgets/master/network-throughput/network-throughput.widget.zip,,,,Y,True,network-throughput.widget,,
now-playing,Now Playing,Levi Figueira,"Displays current track information (track name, artist, and album––Spotify-only for now), with the album's cover artwork as the backdrop.",now-playing.widget.zip,https://raw.githubusercontent.com/levifig/now-playing.widget/master/./now-playing.widget.zip,,,,Y,True,now-playing.widget,,
omnifocus-widget,OmniFocus Flagged List,Fitz H. Agard,Show all your flagged tasks from OmniFocus,omnifocusflags.widget.zip,https://raw.githubusercontent.com/fitzagard/omnifocus-widget/master/./omnifocusflags.widget.zip,,,,Y,True,omnifocusflags.widget,,
only-this,Only this today,Beni Gartenmann,Productivity approach by John Henry Müller,only-this.widget.zip,https://raw.githubusercontent.com/bgartenmann/uebersicht-only-this-widget/master/./only-this.widget.zip,,,,Y,False,only-this.widget,,
outdated-brew-formulae,Outdated Brew Formulae,Greg Major,A small list that shows your outdated brew formulae.,outdated-brew-formulae.widget.zip,https://raw.githubusercontent.com/gregmajor/ubersicht-outdated-brew-formulae-widget/master/./outdated-brew-formulae.widget.zip,,,,Download Failed,False,outdated-brew-formulae.widget,,
pic-display.widget,pic-display.widget,Trapper777,Simply puts a pic of your choice on your desktop.,pic-display.widget.zip,https://raw.githubusercontent.com/Trapper777/pic-display.widget/master/./pic-display.widget.zip,,,,Y,True,pic-display.widget,,
ping-history,Ping History,bonus_tm,Pings sites and shows history graphs,ping-history.widget.zip,https://raw.githubusercontent.com/bonus-tm/uebersicht-ping-history.widget/master/./ping-history.widget.zip,,,,Y,True,ping-history.widget,,
prayer-time-widget,Muslim Prayer Time,Ashik uddin Ahmad,A beautiful daily muslim prayer-time widget with current prayer highlighted,prayer.widget.zip,https://raw.githubusercontent.com/ashikahmad/prayer-time-widget/master/./prayer.widget.zip,,,,Y,True,prayer.widget,,
pretty-weather,Pretty Weather,Felix Hageloh,A prettier and simpler weather forcast widget. NOTE: You will need your own forecast.io api key. Please check the README for details.,pretty-weather.widget.zip,https://raw.githubusercontent.com/felixhageloh/pretty-weather/master/./pretty-weather.widget.zip,,,,Y,True,pretty-weather.widget,,
public_ip,Public Ip,George Irwin,Displays your current public IP address,public_ip.widget.zip,https://raw.githubusercontent.com/felixhageloh/uebersicht-widgets/master/public_ip/public_ip.widget.zip,,,,Y,False,public_ip.widget,,
reddit-karma.widget,reddit-karma,Rafi Khan,adds up your post and comment karma and displays it on your desktop,reddit-karma.widget.zip,https://raw.githubusercontent.com/z3t0/reddit-karma.widget/master/./reddit-karma.widget.zip,,,,Y,False,reddit-karma.widget,,
reddit-overview.widget,reddit-overview,diceroll123,"Keep track of user karma, and have quick-links to subreddits!",reddit-overview.widget.zip,https://raw.githubusercontent.com/diceroll123/reddit-overview.widget/master/./reddit-overview.widget.zip,,,,Y,True,reddit-overview.widget,,
roundClock,roundClock,Evan Bovie,A twist on the traditional analogue clock,roundClock.widget.zip,https://raw.githubusercontent.com/phaseOne/roundClock/master/./roundClock.widget.zip,,,,Y,True,roundClock.widget,,
scrolling-cpu-meter,scrolling-cpu-meter,Spencer Gerald Robinson,displays your cpu usage as bars going down your screen,scrolling-cpu-meter.widget.zip,https://raw.githubusercontent.com/FunkyQChicken/scrolling-cpu-meter/master/./scrolling-cpu-meter.widget.zip,,,,Y,True,scrolling-cpu-meter.widget,,
simple-clock,simple-clock,Spencer Oberstadt,"A big, simple clock",simple-clock.widget.zip,https://raw.githubusercontent.com/soberstadt/simple-clock-widget/master/./simple-clock.widget.zip,,,,Y,True,simple-clock.widget,,
simple-stocks,Simple Stocks,Adam Courtemanche,Shows stock information with minimal configuration required (simply specify the symbols),simple-stocks.widget.zip,https://raw.githubusercontent.com/felixhageloh/uebersicht-widgets/master/simple-stocks/simple-stocks.widget.zip,,,,Y,True,simple-stocks.widget,,
slideshow,TumblrIMG,Paul Andrews,Displays a slide show of the most recent 20 images in an image tumblr,tumblrimg.widget.zip,https://raw.githubusercontent.com/mpandrews2000/slideshow/master/./tumblrimg.widget.zip,,,,N,False,tumblrimg.widget,,
solar-system.widget,solar-system.widget,Travis Triglianos,Displays current location of planets in the solar system,solar-system.widget.zip,https://raw.githubusercontent.com/travtrigs/solar-system.widget/master/./solar-system.widget.zip,,,,Download Failed,False,solar-system.widget,,
stackexchange.widget,StackExchange Widget,Martin Straub,StackExchange Widget,stackexchange.widget.zip,https://raw.githubusercontent.com/d4rkd3v1l/uebersicht-stackexchange.widget/master/./stackexchange.widget.zip,,,,Y,True,stackexchange.widget,,
statuscake,StatusCake Report,Colin O'Brien,Displays the StatusCake up or down status for your sites.,statuscake.widget.zip,https://raw.githubusercontent.com/things/uebersicht-statuscake/master/./statuscake.widget.zip,,,,Y,True,statuscake.widget,,
sticky-notes-ubersicht,Sticky Notes,Alexandru Popa,Sticky Notes for Ubersicht Mac OS X,sticky-note-ubersicht.widget.zip,https://raw.githubusercontent.com/zanderp/sticky-notes-ubersicht/master/./sticky-note-ubersicht.widget.zip,,,,N,False,sticky-note-ubersicht.widget,,
stravasicht,Stravasicht,Dragan Marjanovic,A widget to visualise various Strava metrics.,stravasicht.widget.zip,https://raw.githubusercontent.com/draganmarjanovic/stravasicht/master/./stravasicht.widget.zip,,,,N,False,stravasicht.widget,,
sunradar,Sun Radar,Lakiryt,A widget displaying the position of the sun.,sunradar.widget.zip,https://raw.githubusercontent.com/lakiryt/sunradar/master/./sunradar.widget.zip,,,,Y,True,sunradar.widget,,
swap-usage,Swap Usage,Eric Miller,Display swap file metrics for your system. Style based on Top CPU and Top MEM widgets by Felix Hageloh.,swap-usage.widget.zip,https://raw.githubusercontent.com/felixhageloh/uebersicht-widgets/master/swap-usage/swap-usage.widget.zip,,,,Y,True,swap-usage.widget,,
swiss-sbb-connections,Swiss SBB Connections,Dimitri König,Displays your favorite Swiss SBB connections,uebersicht-widget-for-swiss-transport-data.widget.zip,https://raw.githubusercontent.com/dimitri-koenig/uebersicht-widget-for-swiss-transport-data/master/./uebersicht-widget-for-swiss-transport-data.widget.zip,,,,N,False,uebersicht-widget-for-swiss-transport-data.widget,,
sys-mon-set,Sysmon Set,George Irwin and others,An arrangement of system monitoring widgets.,sys-mon-set.widget.zip,https://raw.githubusercontent.com/felixhageloh/uebersicht-widgets/master/sys-mon-set/sys-mon-set.widget.zip,,,,Y,True,sys-mon-set.widget,,
sys-monitor,SYS Monitor,Kevin Porten,System information about your mac in a real-time chart,sys-monitor.widget.zip,https://raw.githubusercontent.com/kporten/uebersicht-sys-monitor/master/./sys-monitor.widget.zip,,,,Y,True,sys-monitor.widget,,
things.widget,Things - Today,David Mitchell,Displays everything in the 'Today' section from Things,things.widget.zip,https://raw.githubusercontent.com/digitalbias/things.widget/master/./things.widget.zip,,,,Y,False,things.widget,,
time-of-angels,Time of Angels,cytec,Don't you blink!,time-of-angels.widget.zip,https://raw.githubusercontent.com/cytec/uebersicht-time-of-angels/master/./time-of-angels.widget.zip,,,,Y,True,time-of-angels.widget,,
time_since,time since,John Mathews,"Shows the time elapsed since a specified date and time, with options to put text before and after, and abreviate.",time_since.widget.zip,https://raw.githubusercontent.com/johnmathews/time_since/master/./time_since.widget.zip,,,,Y,True,time_since.widget,,
time_until,time until,John Mathews,"Shows the time until a specified date and time, with options to put text before and after.",time_until.widget.zip,https://raw.githubusercontent.com/johnmathews/time_until/master/./time_until.widget.zip,,,,Y,True,time_until.widget,,
tmstatus,tmstatus,Adrian Rudman,Displays current Time Machine process status discreetly.,tmstatus.widget.zip,https://raw.githubusercontent.com/rudders/tmstatus/master/./tmstatus.widget.zip,,,,Y,True,tmstatus.widget,,
to-do-list,To Do List,Rich Somerfield,Display a basic todo list on screen,to-do-list.widget.zip,https://raw.githubusercontent.com/felixhageloh/uebersicht-widgets/master/to-do-list/to-do-list.widget.zip,,,,Y,False,to-do-list.widget,,
todo.txt-widget,todo.txt-widget,John Niven,Simple widget to display your todo.txt-based to-do list on your desktop,todo.widget.zip,https://raw.githubusercontent.com/16kRAMpack/todo.txt-widget/master/./todo.widget.zip,,,,Y,True,todo.widget,,
todolist-widget,Todolist widget,langhaarzombie,Widget for todolist manager http://todolist.site,todolist.widget.zip,https://raw.githubusercontent.com/Langhaarzombie/todolist-widget/master/./todolist.widget.zip,,,,Y,False,todolist.widget,,
top-cpu,Top CPU,Felix Hageloh,Shows a CPU usage summary.,top-cpu.widget.zip,https://raw.githubusercontent.com/felixhageloh/uebersicht-widgets/master/top-cpu/top-cpu.widget.zip,,,,Y,True,top-cpu.widget,,
top-mem,Top MEM,Felix Hageloh,Shows a memory usage summary.,top-mem.widget.zip,https://raw.githubusercontent.com/felixhageloh/uebersicht-widgets/master/top-mem/top-mem.widget.zip,,,,Y,True,top-mem.widget,,
trash-size,Trash Size,MrKireko,Displays the size of your trash conveniently,trash-size.widget.zip,https://raw.githubusercontent.com/MrKireko/trash-size/master/./trash-size.widget.zip,,,,Y,True,trash-size.widget,,
trello,Trello Widget for Übersicht,Nick Busey,Display the contents of a List of a Trello board on your desktop.,Trello.widget.zip,https://raw.githubusercontent.com/NickBusey/Ubersicht-Trello-Widget/master/./Trello.widget.zip,,,,Y,True,Trello.widget,,
trellocard,trellocard,G Sousa,Display trello card information in the left of your desktop,trellocard-master.zip,https://raw.githubusercontent.com/guxsousa/trellocard/master/./trellocard-master.zip,,,,Y,True,trellocard-master,,
tsushin,tsushin,Ryuei Sasaki,A graph that shows total up and down data being transferred to your Mac. Heavily inspired by the work of Dion Munk - network-throughput. This widget now includes a smaller version in tsushin_small.widget (Width 200 Height 50).,tsushin_small.widget.zip,https://raw.githubusercontent.com/louixs/tsushin/master/./tsushin_small.widget.zip,,,,Y,True,tsushin_small.widget,,
uberist,Uberist,Mike Chen,Wunderlist3 widget for Übersicht,uberist.widget.zip,https://raw.githubusercontent.com/chagel/uberist/master/./uberist.widget.zip,,,,Y,True,uberist.widget,,
ubersicht-astronauts,How Many People Are In Space Right Now?,Philipp Christen,Shows the number of people (including names) that are in space right now,astronauts.widget.zip,https://raw.githubusercontent.com/LePhil/ubersicht-astronauts/master/./astronauts.widget.zip,,,,Y,True,astronauts.widget,,
ubersicht-currentKeymap,Ubersicht current key layout,Ruslan Bekenev,Shows current keymap as a flag,showInputSource.widget.zip,https://raw.githubusercontent.com/KryDos/ubersicht-currentKeymap/master/./showInputSource.widget.zip,,,,Y,True,showInputSource.widget,,
ubersicht-docker-containers,dockercontainers,Paulo Gomes,Display docker running containers with details,dockercontainers.widget.zip,https://raw.githubusercontent.com/pauloamgomes/ubersicht-docker-containers/master/./dockercontainers.widget.zip,,,,Y,True,dockercontainers.widget,,
ubersicht-network-throughput,Network Throughput Monitor,Dion Munk,A simple network throughput monitor.,network-throughput.widget.zip,https://raw.githubusercontent.com/dionmunk/ubersicht-network-throughput/master/./network-throughput.widget.zip,,,,Y,True,network-throughput.widget,,
ubersicht-now-playing,Now Playing,Dion Munk,A music widget based on the Playbox widget for Übersicht.,now-playing.widget.zip,https://raw.githubusercontent.com/dionmunk/ubersicht-now-playing/master/./now-playing.widget.zip,,,,Y,True,now-playing.widget,,
ubersicht-putio,put.io viewer,Honza Babarik,Have info about your latest TV Shows available at put.io right on your Mac desktop.,putio.widget.zip,https://raw.githubusercontent.com/gitzerai/ubersicht-putio/master/./putio.widget.zip,,,,Y,False,putio.widget,,
ubersicht-wanikani,Wanikani Lessons & Reviews,jakeoid,Shows the lessons and reviews in which are on WaniKani!,wanikani_lesandrev.widget.zip,https://raw.githubusercontent.com/jakeoid/ubersicht-wanikani/master/./wanikani_lesandrev.widget.zip,,,,Y,False,wanikani_lesandrev.widget,,
ubersichtGitInfo,ubersichtGitInfo,Sy Le,Allow you to track a list of folders stored in your local machines and their current branches,ubersichtGitInfo.widget.zip,https://raw.githubusercontent.com/synle/ubersichtGitInfo/master/./ubersichtGitInfo.widget.zip,,,,Y,True,ubersichtGitInfo.widget,,
ubersicht_gmail,Gmail,Ryuei Sasaki,Displays the sender and subject line of the latest email delivered to your gmail Inbox. This is a part of Übersicht Google Widgets bundle.,gmail.widget.zip,https://raw.githubusercontent.com/louixs/ubersicht_gmail/master/./gmail.widget.zip,,,,Y,True,gmail.widget,,
ubersicht_google_calendar,Google Calendar widget for Übersicht,Ryuei Sasaki,Displays today's and tomorrow's events for multiple Google calendars that the user has access to view using Google API and Google oauth2. This is the first in the Übersicht Google Widgets bundle I am working on,calendar.widget.zip,https://raw.githubusercontent.com/louixs/ubersicht_google_calendar/master/./calendar.widget.zip,,,,Y,True,calendar.widget,,
ubersicht_tasks,Google Tasks,Ryuei Sasaki,Displays the latest X number of Google tasks based on the updated date,tasks.widget.zip,https://raw.githubusercontent.com/louixs/ubersicht_tasks/master/./tasks.widget.zip,,,,Y,True,tasks.widget,,
uebersicht-central-logo-widget,Central-logo,aykot,displays a centered pic on desktop,uebersicht-central-logo-widget.zip,https://raw.githubusercontent.com/aykot/uebersicht-central-logo-widget/master/./uebersicht-central-logo-widget.zip,,,,Y,False,uebersicht-central-logo-widget,,
uebersicht-ethereum-usd-price,eth,Adrien Kühn,Get ethereum price in USD,eth.widget.zip,https://raw.githubusercontent.com/AdrienKuhn/uebersicht-ethereum-usd-price/master/./eth.widget.zip,,,,Download Failed,False,eth.widget,,
