OS_widget_id,OS_name,OS_author,OS_description,PS_filename,OS_download_url,AI_category,AI_secondary_category,AI_prompt,PS_iscoffee,PS_complexcoffee,PS_widgetfoldername,CT_set,CT_comment
uebersicht-github-activity,github-activity,shadowfacts,A visual representation of your GitHub contributions.,github-activity.widget.zip,https://raw.githubusercontent.com/shadowfacts/uebersicht-github-activity/master/./github-activity.widget.zip,,,,N,False,github-activity.widget,,
uebersicht-sensu,Sensu Overview,Alexander Skiba,"Displays your Sensu errors, warnings and unknown stati.",sensu.widget.zip,https://raw.githubusercontent.com/GhostLyrics/uebersicht-sensu/master/./sensu.widget.zip,,,,Y,True,sensu.widget,,
uebersicht-spotify-adsilencer.widget,Spotify Mini Player And Ad Silencer,David López,"A widget that let's you play/pause the current Spotify song, go backward the previous one, go forward the next one and see the name, artist and cover of the track. It also detects Spotify ads and silences them.",Spotify-AdSilencer.widget.zip,https://raw.githubusercontent.com/Dellos7/uebersicht-spotify-adsilencer.widget/master/./Spotify-AdSilencer.widget.zip,,,,Y,True,Spotify-AdSilencer.widget,,
uebersicht-taskpaper,TaskPaper Uebersicht,Flow,Displays a selection of taskpaper tasks on screen,taskpaper.widget.zip,https://raw.githubusercontent.com/flow7/uebersicht-taskpaper/master/./taskpaper.widget.zip,,,,Y,True,taskpaper.widget,,
uebersicht-widget-public_ip,public_ip2,Marc Donkers,"Public IP showing with flag of the IP's country, useful when using VPN's",public_ip2.widget.zip,https://raw.githubusercontent.com/i07/uebersicht-widget-public_ip/master/./public_ip2.widget.zip,,,,Y,False,public_ip2.widget,,
uebersicht-wiki-holidays.widget,Wiki Holidays,Diego Martins de Siqueira,An Ubersicht widget which show holidays information,wiki-holidays.widget.zip,https://raw.githubusercontent.com/DiSiqueira/uebersicht-wiki-holidays.widget/master/./wiki-holidays.widget.zip,,,,Y,False,wiki-holidays.widget,,
uebersicht_ch_meteo_widget,CH Meteo,guillem,Shows meteo data from a selected Swiss station,ch_meteo.widget.zip,https://raw.githubusercontent.com/gbuendia/uebersicht_ch_meteo_widget/master/./ch_meteo.widget.zip,,,,Y,True,ch_meteo.widget,,
usefulinfo,Useful Information Display,Justin Ellingson,This widget displays useful information on the desktop in the same style as BGInfo for windows machines,useful-info.widget.zip,https://raw.githubusercontent.com/justinellingson/usefulinfowidget/master/./useful-info.widget.zip,,,,Y,True,useful-info.widget,,
valerian-time,Valerian Time,Armin Rosu,"An Übersicht clock widget based on a pen by Allan Crissey, comissioned by Valéria Boikova.",valerian-time.widget.zip,https://raw.githubusercontent.com/arminrosu/valerian-time/master/./valerian-time.widget.zip,,,,Y,False,valerian-time.widget,,
vertical-calendar,vertical-calendar,Zach Taffet,A vertical calendar similar to the awesome DateLine app.,vertical-calendar.widget.zip,https://raw.githubusercontent.com/ziti/uebersicht-calendar-widget/master/./vertical-calendar.widget.zip,,,,Y,True,vertical-calendar.widget,,
video-widget,Übersicht Video Widget,Paul B. Hartzog,An HTML5 video widget for adding videos to your Übersicht,ubersicht-video-widget.widget.zip,https://raw.githubusercontent.com/paulbhartzog/ubersicht-video-widget/master/./ubersicht-video-widget.widget.zip,,,,Y,True,ubersicht-video-widget.widget,,
vms.widget,vms.widget,Andy Dishong,"Displays the count of running virtual machines from Fusion, Parallels, and Virtual Box.  Also displays VM name if running.  Only configuration is changing the path to your VM application if different than default. Comment out any VM lines that are not required. UPDATES: Updated Parallels to correctly display the VM. ",vms.widget.zip,https://raw.githubusercontent.com/roadglide03/vms.widget/master/./vms.widget.zip,,,,Y,False,vms.widget,,
vsts.widget,VSTS Widget,Grega Vrbančič,Widget for displaying VSTS list of work items.,vsts.widget.zip,https://raw.githubusercontent.com/GregaVrbancic/vsts.widget/master/./vsts.widget.zip,,,,Y,True,vsts.widget,,
weather,Weather,Felix Hageloh,A simple weather forcast widget. UPDATE: Automatic location and no more API keys!,weather.widget.zip,https://raw.githubusercontent.com/felixhageloh/weather-widget/master/./weather.widget.zip,,,,Y,True,weather.widget,,
weathernow,Weather Now,Brian Connelly,A simple widget that displays the current weather. See the README for details.,weathernow.widget.zip,https://raw.githubusercontent.com/briandconnelly/weathernow-widget/master/./weathernow.widget.zip,,,,Y,True,weathernow.widget,,
wildstar-server-status,Wildstar Server Status,Eric Miller,Display server status for the specified Wildstar (MMO) server.  This uses http://wsstatus.com for status,wildstar-server-status.widget.zip,https://raw.githubusercontent.com/felixhageloh/uebersicht-widgets/master/wildstar-server-status/wildstar-server-status.widget.zip,,,,Y,True,wildstar-server-status.widget,,
word-of-the.widget,Word of the...,Evan Payne,Elegant display of random words and their definitions.,word-of-the.widget.zip,https://raw.githubusercontent.com/evanfuture/word-of-the.widget/master/./word-of-the.widget.zip,,,,Y,True,word-of-the.widget,,
words-worldclock,Word Clock,Wojciech Rutkowski,Inspired by Word Clock on Instructables: http://www.instructables.com/id/Sleek-word-clock/,wordclock.widget.zip,https://raw.githubusercontent.com/wrutkowski/ubericht-wordclock/master/./wordclock.widget.zip,,,,Y,False,wordclock.widget,,
worldcup,worldcup,Michael Goldmann,Display today's worldcup matches,worldcup.widget.zip,https://raw.githubusercontent.com/felixhageloh/uebersicht-widgets/master/worldcup/worldcup.widget.zip,,,,Y,False,worldcup.widget,,
wttr,Wttr Forecast,Bastian Kroggel,Wttr Forecast is a multi-location weather widget that stores all weather information locally on your device and allows you to access forecasts even when you are offline.,wttr.widget.zip,https://raw.githubusercontent.com/bkroggel/wttr/master/./wttr.widget.zip,,,,Y,True,wttr.widget,,
wttr-moon-uebersicht,wttr.in/Moon,matthias-vogt,Shows wttr.in Moon info,wttr-moon.widget.zip,https://raw.githubusercontent.com/matthias-vogt/wttr-moon-uebersicht/master/./wttr-moon.widget.zip,,,,N,False,wttr-moon.widget,,
wttr-uebersicht,wttr.in,matthias-vogt,Minimal ASCII-Art weather forecast,wttr.widget.zip,https://raw.githubusercontent.com/matthias-vogt/wttr-uebersicht/master/./wttr.widget.zip,,,,Y,True,wttr.widget,,
wunderlist-tasks,Wunderlist Tasks,Nikita Bazhenov,Display Wunderlist open tasks,wunderlist-tasks.widget.zip,https://raw.githubusercontent.com/NikitaBazhenov/UbersichtWunderlistTasks/master/./wunderlist-tasks.widget.zip,,,,Y,True,wunderlist-tasks.widget,,
xkcd-random,xkcd-random.widget,@PapyPev and @Cajova-Houba,A widget that displays a random xkcd comic,xkcd-random.widget.zip,https://raw.githubusercontent.com/PapyPev/xkcd-random.widget/master/./xkcd-random.widget.zip,,,,Y,False,xkcd-random.widget,,
youtube-video,Übersicht YouTube Video Widget,Paul B. Hartzog,An HTML5 video widget for adding YouTube videos to your Übersicht,ubersicht-youtube-video.widget.zip,https://raw.githubusercontent.com/paulbhartzog/ubersicht-youtube-video-widget/master/./ubersicht-youtube-video.widget.zip,,,,Y,False,ubersicht-youtube-video.widget,,
zendesk,Zendesk tickets,Alex Heinz,"Display new, open and pending tickets",zendesk.widget.zip,https://raw.githubusercontent.com/unglud/ubersicht-zendesk/master/./zendesk.widget.zip,,,,Y,True,zendesk.widget,,
cpumeter,CPUMeter,Brett Terpstra,Displays top CPU processes.,cpumeter.widget.zip,https://raw.githubusercontent.com/ttscoff/ubersicht-widgets/master/cpumeter/cpumeter.widget.zip,,,,Y,False,cpumeter.widget,,
load,Load,Brett Terpstra,Displays the 5m average load as a large number with color coding.,load.widget.zip,https://raw.githubusercontent.com/ttscoff/ubersicht-widgets/master/load/load.widget.zip,,,,Y,True,load.widget,,
loadbar,Average load bar,Brett Terpstra,Displays the 5m average load as a colored bar on the left side of the screen.,loadbar.widget.zip,https://raw.githubusercontent.com/ttscoff/ubersicht-widgets/master/loadbar/loadbar.widget.zip,,,,Y,True,loadbar.widget,,
loadchart,LoadChart,Brett Terpstra,Displays the 5m average load over time as a graph.,loadchart.widget.zip,https://raw.githubusercontent.com/ttscoff/ubersicht-widgets/master/loadchart/loadchart.widget.zip,,,,Y,True,loadchart.widget,,
memmeter,MemMeter,Brett Terpstra,Displays top RAM processes,memmeter.widget.zip,https://raw.githubusercontent.com/ttscoff/ubersicht-widgets/master/memmeter/memmeter.widget.zip,,,,Y,False,memmeter.widget,,
pingo,Pingo,Brett Terpstra,"Displays 10-ping average, packet loss, and chart of results over time.",pingo.widget.zip,https://raw.githubusercontent.com/ttscoff/ubersicht-widgets/master/pingo/pingo.widget.zip,,,,Y,True,pingo.widget,,
timemachine,TimeMachine,Brett Terpstra,Displays Time Machine backup status.,timemachine.widget.zip,https://raw.githubusercontent.com/ttscoff/ubersicht-widgets/master/timemachine/timemachine.widget.zip,,,,Y,True,timemachine.widget,,
feedme,FeedMe RSS Widget,Morten sieker,Display the latest posts from an RSS feed,feedme.widget.zip,https://raw.githubusercontent.com/mortensieker/ubersicht/master/feedme/feedme.widget.zip,,,,Download Failed,False,feedme.widget,,
pingme,PingMe Widget,Morten sieker,Displays the average response time for a given site,pingme.widget.zip,https://raw.githubusercontent.com/mortensieker/ubersicht/master/pingme/pingme.widget.zip,,,,Download Failed,False,pingme.widget,,
nanopool.widget,nanopool,onedee,Get your nanopool stats for a specific account,nanopool.widget.zip,https://raw.githubusercontent.com/onedee88/nanopool.widget/master/nanopool.widget.zip,,,,Y,False,nanopool.widget,,
particles.widget,particles,Jordan Parker,A slow moving particle effect,particles.widget.zip,https://raw.githubusercontent.com/nepthar/particles.widget/master/particles.widget.zip,,,,N,False,particles.widget,,
ubersicht-ripple-usd-price,XRP,Eugen Luft,Get Ripple price in USD,xrp.widget.zip,https://raw.githubusercontent.com/eluft84/ubersicht-ripple-usd-price/master/xrp.widget.zip,,,,Y,False,xrp.widget,,
daytime-to-do-list,daytime-to-do-list,Michele Giugliano,Shows tasks (from macOS Reminders) during working hours only,daytime-to-do-list.zip,https://raw.githubusercontent.com/mgiugliano/daytime-to-do-list/master/daytime-to-do-list.zip,,,,Y,True,daytime-to-do-list,,
ubersicht-cryptocurrency,Cryptocurrency Widget,Dmitry Jerusalimsky,Cryptocurrency portfolio tracker,Cryptocurrency.widget.zip,https://raw.githubusercontent.com/dimaj/ubersicht-cryptocurrency/master/Cryptocurrency.widget.zip,,,,Y,True,Cryptocurrency.widget,,
Casinocoin.widget,CSC Casinocoin,Lex Deeley,Get Casinocoin price in USD,CasinoCoin.widget.zip,https://raw.githubusercontent.com/LexingtonStanley/Casinocoin.widget/master/CasinoCoin.widget.zip,,,,Y,False,CasinoCoin.widget,,
Ubersicht-Shades-of-K,Shades of K,Porco-Rosso,This widget sets your wallpaper to a customisable set of colour gradient bands that change with the time!,Shades-of-K.widget.zip,https://raw.githubusercontent.com/Porco-Rosso/Ubersicht-Shades-of-K/master/Shades-of-K.widget.zip,,,,Y,False,Shades-of-K.widget,,
SDCardLocation,SDCardLocation,Mike Campbell,Ubersicht widget to visually see where the SD card slot is on an iMac,SDCardLocation.widget.zip,https://raw.githubusercontent.com/mlcampbe/SDCardLocation/master/SDCardLocation.widget.zip,,,,Download Failed,False,SDCardLocation.widget,,
stock-widget,stock-widget,Josh S.,Displays current price for a single stock,stock.widget.zip,https://raw.githubusercontent.com/monkeemunk/stock-widget/master/stock.widget.zip,,,,Y,True,stock.widget,,
teawallpaper,teawallpaper,Mike Campbell,Wallpaper that changes color thoughout the day,teawallpaper.widget.zip,https://raw.githubusercontent.com/mlcampbe/teawallpaper/master/teawallpaper.widget.zip,,,,Download Failed,False,teawallpaper.widget,,
IMDbScraper.widget,IMDbScraper,Kashish Arora,Displays in-theater/coming-soon movies from IMDb and stores user-selected movies in local storage.,IMDbScraper.widget.zip,https://raw.githubusercontent.com/kaarora123/IMDbScraper.widget/master/IMDbScraper.widget.zip,,,,Y,True,IMDbScraper.widget,,
marketcap-widget,Cryptocurrency Market Cap Desktop Widget,Zhancheng Qian,Minimalist desktop widget for Mac to get the latest cryptocurrency market cap right on your desktop! Please give me a star on Github if you like it! Made possible with coinmarketcap API. Inspired by Sebastian Stiernborg's Cryptocurrency price widget.,marketcap.widget.zip,https://raw.githubusercontent.com/zhanchengqian/marketcap-widget/master/marketcap.widget.zip,,,,Y,True,marketcap.widget,,
simple-analog-clock,Simple Analog Clock,Viktor Hundahl Strate,A light themed analog clock,simple-analog-clock.widget.zip,https://raw.githubusercontent.com/viktorstrate/simple-analog-clock/master/simple-analog-clock.widget.zip,,,,Y,True,simple-analog-clock.widget,,
weather-forecast-io,weather-forecast-io,Mike Campbell,Weather script that pulls current conditions from forecast-io,weather-forecast-io.widget.zip,https://raw.githubusercontent.com/mlcampbe/weather-forecast-io/master/weather-forecast-io.widget.zip,,,,Download Failed,False,weather-forecast-io.widget,,
Ubersicht-Solid,solid,Simon,sets a changing solid color as desktop background,solid.coffee.zip,https://raw.githubusercontent.com/Siiiimon/Ubersicht-Solid/master/solid.coffee.zip,,,,Y,False,solid.coffee,,
Uebersicht-SpotTheStationWidget,Spot The Station,Lari Kovanen,shows when ISS passes the next time for a location,SpotTheStation.widget.zip,https://raw.githubusercontent.com/larkov/Uebersicht-SpotTheStationWidget/master/SpotTheStation.widget.zip,,,,Y,False,SpotTheStation.widget,,
home,home,Paco Coursey,Home is a themeable block-style widget for Übersicht,home.widget.zip,https://raw.githubusercontent.com/pacocoursey/home/master/home.widget.zip,,,,Download Failed,False,home.widget,,
potd,potd,Mike Campbell,Display a new wallpaper from various internet picture-of-the-day sources,potd.zip,https://raw.githubusercontent.com/mlcampbe/potd/master/potd.zip,,,,Download Failed,False,potd,,
FlightPriceTracker.widget,FlightPriceTracker.widget,Kashish Arora,Displays price + information about the top three flights found for a specific trip.,FlightPriceTracker.widget.zip,https://raw.githubusercontent.com/kaarora123/FlightPriceTracker.widget/master/FlightPriceTracker.widget.zip,,,,Y,False,FlightPriceTracker.widget,,
fuzzytime-with-date.widget,fuzzytime with date,Gert Massheimer,Display fuzzy time and the date in the top left of your desktop. Works in German and English.,fuzzytime-with-date.widget.zip,https://raw.githubusercontent.com/DeltaOS2/fuzzytime-with-date.widget/master/fuzzytime-with-date.widget.zip,,,,Y,True,fuzzytime-with-date.widget,,
weather-underground.widget,Weather-Display with Weather Underground Data,Gert Massheimer,Displays the weather / forcast in 4 different ways. Zeigt das Wetter in 4 verschiedenen Ansichten an.,weather-underground.widget.zip,https://raw.githubusercontent.com/DeltaOS2/weather-underground.widget/master/weather-underground.widget.zip,,,,Y,True,weather-underground.widget,,
gradient-bg,gradient-bg,John Mars,A color-changing gradient background for Übersicht,gradient-bg.widget.zip,https://raw.githubusercontent.com/j0hnm4r5/gradient-bg/master/gradient-bg.widget.zip,,,,N,False,gradient-bg.widget,,
ubersicht-GPMDP,GPMDP,Michael Pardo,Now playing widget for Google Play Music Desktop Player,GPMDP.widget.zip,https://raw.githubusercontent.com/pardom/ubersicht-GPMDP/master/GPMDP.widget.zip,,,,N,False,GPMDP.widget,,
every-color,Every Color,Maxwell Conser,Display every RGB color over time.,every-color.widget.zip,https://raw.githubusercontent.com/maxwell-conser/every-color/master/every-color.widget.zip,,,,Y,False,every-color.widget,,
cqupt-class.widget,CQUPT Class Schedule,CoderMing,A class Schedule for CQUPT students,cqupt-class.widget.zip,https://raw.githubusercontent.com/CoderMing/cqupt-class.widget/master/cqupt-class.widget.zip,,,,Y,True,cqupt-class.widget,,
kubernetes.widget,Kubernetes,Clive Zagno,Wdigets that show details of a kubernetes cluster,kubernetes.widget.zip,https://raw.githubusercontent.com/zagno/kubernetes.widget/master/kubernetes.widget.zip,,,,Y,True,kubernetes.widget,,
Show-Uptime,Device Uptime,Jason Thomas,Show how many days your Mac has been running.,uptime-display.widget.zip,https://raw.githubusercontent.com/JLJTECH/Show-Uptime/master/uptime-display.widget.zip,,,,Y,False,uptime-display.widget,,
strip-calendar.widget,Strip Calendar,Simon Kennedy,A calendar displayed in a strip.,strip-calendar.widget.zip,https://raw.githubusercontent.com/sffjunkie/strip-calendar.widget/master/strip-calendar.widget.zip,,,,Y,True,strip-calendar.widget,,
ironman-reactor-ubersicht-widget,Ironman Reactor,David López,Ironman Reactor with rotating coils in your desktop.,ironman-reactor.widget.zip,https://raw.githubusercontent.com/Dellos7/ironman-reactor-ubersicht-widget/master/ironman-reactor.widget.zip,,,,Y,False,ironman-reactor.widget,,
os-version-pro,OS Version Pro,Mike Pennella,An Ubersicht widget that displays a badge on the desktop with OS release name and version information,os_version_pro.widget.zip,https://raw.githubusercontent.com/mpen01/os-version-pro/master/os_version_pro.widget.zip,,,,Y,True,os_version_pro.widget,,
myschedule,myschedule,William,"My schedule, also your schedule",myschedule.zip,https://raw.githubusercontent.com/Freakwill/myschedule/master/myschedule.zip,,,,Y,False,myschedule,,
true-binary-mode-clock,True binary clock,Dmytro Panin,Displays the time in the true binary way,true-binary-mode-clock.widget.zip,https://raw.githubusercontent.com/dr-mod/true-binary-mode-clock/master/true-binary-mode-clock.widget.zip,,,,N,False,true-binary-mode-clock.widget,,
quake-watch-2,quake-watch-2,Scott Immerman,Displays the latest Earthquakes from the USGS,quake-watch-2.widget.zip,https://raw.githubusercontent.com/TechJedi51/quake-watch-2/master/quake-watch-2.widget.zip,,,,Y,True,quake-watch-2.widget,,
qotd.widget,qotd,Michel Casillas,Show your quotes without internet.,qotd.widget.zip,https://raw.githubusercontent.com/T4K3R0/qotd.widget/master/qotd.widget.zip,,,,Y,False,qotd.widget,,
Mac-OS-9-for-Ubersicht,Mac OS 9 Startup Simulator Widget,erickson studio,Simulates the Mac OS 9 Startup Screen and includes an optional clock. It's scaleable!,MacOS9.widget.zip,https://raw.githubusercontent.com/ericksonstudio/Mac-OS-9-for-Ubersicht/master/MacOS9.widget.zip,,,,Y,True,MacOS9.widget,,
radioDeejay_nowPlaying.widget,Radio Deejay Now Playing,sammosna,Get informations about what's playing on one of the best radio in Italy 🇮🇹,radioDeejay_nowPlaying.widget.zip,https://raw.githubusercontent.com/sammosna/radioDeejay_nowPlaying.widget/master/radioDeejay_nowPlaying.widget.zip,,,,Y,False,radioDeejay_nowPlaying.widget,,
Inbox-for-Todoist,Inbox for Todoist,Benjamin Chausse,An Übersicht widget for your Todoist Inbox,inbox_for_todoist.widget.zip,https://raw.githubusercontent.com/ChausseBenjamin/Inbox-for-Todoist/master/inbox_for_todoist.widget.zip,,,,Y,True,inbox_for_todoist.widget,,
Ubersicht-Netdata,Netdata,Porco-Rosso,A widget that allows you to view Netdata graphs directly from your desktop with Übersicht.,netdata.widget.zip,https://raw.githubusercontent.com/Porco-Rosso/Ubersicht-Netdata/master/netdata.widget.zip,,,,N,False,netdata.widget,,
modifiable-clock,Modifiable clock,David Gimeno,Highly modifiable clock/date combo. First self-learning project with cofeescript and übersicht. Enjoy customizing your desktop clock!,modifiable-clock.widget.zip,https://raw.githubusercontent.com/daliife/modifiable-clock/master/modifiable-clock.widget.zip,,,,Y,True,modifiable-clock.widget,,
ubersicht-quotes-widget,Quotes,Dmitry Wolf,Show your favourite quotes stored in handy .yaml file,quotes.widget.zip,https://raw.githubusercontent.com/diimdeep/ubersicht-quotes-widget/master/quotes.widget.zip,,,,N,False,quotes.widget,,
ubersicht-gitissues,GitIssues,Hendrik Erz,View the latest issues of a GitHub repository,gitissues.widget.zip,https://raw.githubusercontent.com/nathanlesage/ubersicht-gitissues/master/gitissues.widget.zip,,,,N,False,gitissues.widget,,
MerakiUebersichtColorized,Meraki and Wifi Widget with Color!,Alex Burger,Wifi Data and Meraki Device Connectivity Colorized,WifiDataMerakiColorized.widget.zip,https://raw.githubusercontent.com/aaburger85/MerakiUebersichtColorized/master/WifiDataMerakiColorized.widget.zip,,,,Y,False,WifiDataMerakiColorized.widget,,
transmission-uebersicht,Transmission,Sesquipedalian,Monitor a Transmission client.,transmission.widget.zip,https://raw.githubusercontent.com/Sesquipedalian/transmission-uebersicht/master/transmission.widget.zip,,,,Y,True,transmission.widget,,
margins-uebersicht,Margins,Sesquipedalian,Keeps widgets from getting covered up by the Dock or desktop icons.,margins.coffee.zip,https://raw.githubusercontent.com/Sesquipedalian/margins-uebersicht/master/margins.coffee.zip,,,,Y,True,margins.coffee,,
Airflo-ubersicht,Airflo,Carlos G.,Displays air quality index (AQI) in your city.,airflo.widget.zip,https://raw.githubusercontent.com/kelvinwebdesigner/Airflo-ubersicht/master/airflo.widget.zip,,,,N,False,airflo.widget,,
check-urls,check-urls,Stefan Jacobs,"Display status of urls, see github @ ",check-urls.widget.zip,https://raw.githubusercontent.com/stefanjacobs/check-urls/master/check-urls.widget.zip,,,,Y,True,check-urls.widget,,
theonewidget,OneWidget,wyattsmcall1,Sidebar,TheOneWidget.widget.zip,https://raw.githubusercontent.com/wyattsmcall1/theonewidget/master/TheOneWidget.widget.zip,,,,Y,True,TheOneWidget.widget,,
uptime-pro,Uptime Pro,Mike Pennella,An Ubersicht widget that displays system uptime down to the minute on your desktop,uptime_pro.widget.zip,https://raw.githubusercontent.com/mpen01/uptime-pro/master/uptime_pro.widget.zip,,,,Y,True,uptime_pro.widget,,
daily-ancient-Chinese-prose,daily ancient Chinese prose,liumeng,An Ubersicht widget that displays ancient Chinese prose on your desktop,daily-ancient-Chinese-prose.widget.zip,https://raw.githubusercontent.com/mengrant/daily-ancient-Chinese-prose/master/daily-ancient-Chinese-prose.widget.zip,,,,Y,True,daily-ancient-Chinese-prose.widget,,
uebersicht-ip,IP,Bert Bredewold,"Shows the IP addresses of all your interfaces, including your WAN address.",ip.widget.zip,https://raw.githubusercontent.com/bbredewold/uebersicht-ip/master/ip.widget.zip,,,,N,False,ip.widget,,
ubersicht-calendar,ubersicht-calendar,Kevin Knopp,An Übersicht calendar widget using ES6 syntax and css grid,ubershicht-calendar.widget.zip,https://raw.githubusercontent.com/kknopper/ubersicht-calendar/master/ubershicht-calendar.widget.zip,,,,N,False,ubershicht-calendar.widget,,
ubersicht-zelda-battery,ubersicht-zelda-battery,Alex Taxiera,Legend of Zelda OoT inspired battery meter for Übersicht.,zelda-battery.widget.zip,https://raw.githubusercontent.com/alex-taxiera/ubersicht-zelda-battery/master/zelda-battery.widget.zip,,,,N,False,zelda-battery.widget,,
battery-pro,Battery Pro,Mike Pennella,An Ubersicht widget that displays battery life on the desktop,battery_pro.widget.zip,https://raw.githubusercontent.com/mpen01/battery-pro/master/battery_pro.widget.zip,,,,Y,True,battery_pro.widget,,
marswxwidget,Mars weather,Tony Rice,Mars weather conditions last reported by the InSight lander,marswx.zip,https://raw.githubusercontent.com/rtphokie/marswxwidget/master/marswx.zip,,,,Y,True,marswx,,
uebersicht-jira-filter,uebersicht-jira-filter,Thomas Upton,An Übersicht widget to view a JIRA filter,uebersicht-jira-filter.widget.zip,https://raw.githubusercontent.com/tupton/uebersicht-jira-filter/master/uebersicht-jira-filter.widget.zip,,,,N,False,uebersicht-jira-filter.widget,,
darksky.widget,Weather-Display with DarkSky Data,Gert Massheimer,Displays the weather / forcast in 5 different ways. Zeigt das Wetter in 5 verschiedenen Ansichten an.,darksky.widget.zip,https://raw.githubusercontent.com/DeltaOS2/darksky.widget/master/darksky.widget.zip,,,,Y,True,darksky.widget,,
os-version-uptime.widget,OS-Version-Uptime,Gert Massheimer,Display the macOS version und uptime,os-version-uptime.widget.zip,https://raw.githubusercontent.com/DeltaOS2/os-version-uptime.widget/master/os-version-uptime.widget.zip,,,,Y,True,os-version-uptime.widget,,
iwn-widget,IWN,Andreas,"A minimalist weather widget with temperature, wind speed and conditions",iwn.widget.zip,https://raw.githubusercontent.com/aefrh/iwn-widget/master/iwn.widget.zip,,,,Y,True,iwn.widget,,
cpu_history,CPU History,Terrance Boon,Places a chart of CPU history on the desktop,cpu_history.widget.zip,https://raw.githubusercontent.com/Boon67/cpu_history/master/cpu_history.widget.zip,,,,Y,True,cpu_history.widget,,
battery-bar,Battery Bar,Vikram Venkataramanan,"A bar at the top of the screen that indicates the battery life of the laptop. You can tweak the thickness, and colors of the bar.",battery-bar.widget.zip,https://raw.githubusercontent.com/viktree/battery-bar/master/battery-bar.widget.zip,,,,N,False,battery-bar.widget,,
icloud-widget,iCloud Storage,Finlay A'Court,Widget to show remaining iCloud storage,iCloud.widget.zip,https://raw.githubusercontent.com/finlayacourt/icloud-widget/master/iCloud.widget.zip,,,,Download Failed,False,iCloud.widget,,
Wordclock_NL,Wordclock_NL,Peter Harte,Dutch Wordclock for Übersicht,Wordclock_NL.widget.zip,https://raw.githubusercontent.com/etrahretep/Wordclock_NL/master/Wordclock_NL.widget.zip,,,,Y,False,Wordclock_NL.widget,,
xkcd-ultimate.widget,xkcd-ultimate.widget,mephist0pheles,Responsive custom widget for Übersicht to show the most recent or a random XKCD comic strip on your desktop,xkcd-ultimate.widget.zip,https://raw.githubusercontent.com/mephist0pheles/xkcd-ultimate.widget/master/xkcd-ultimate.widget.zip,,,,Y,True,xkcd-ultimate.widget,,
